id,name,price,category,link,image,description,source
5143,20 compartment Organiser cabinet,13.00,Tool storage,https://www.diy.com/departments/20-compartment-organiser-cabinet/1499442_BQ.prd,https://media.diy.com/is/image/KingfisherDigital/homcom-steel-5-drawer-tool-storage-cabinet-lockable-w-wheels-handle-garage-equipment-trolley-home-work-diy-workshop-chest-black~5056399113000_01c_MP?wid=284&hei=284,Guarantee - 3 yearsComes with Removable compartmentsFeatures and benefitsThe 20 drawers cabinet is suitable for sorting small parts and tools. It can be hung on a wallTough polypropylene structure and traysPolypropylene drawersSafe tool storageEasy to clean and to keep clear,BQ
5144,Mac Allister Black & grey 18 compartment Organiser,28.00,Tool storage,https://www.diy.com/departments/mac-allister-black-grey-18-compartment-organiser/1511733_BQ.prd,https://media.diy.com/is/image/Kingfisher/20-compartment-organiser-cabinet~3663602905424_01bq?wid=284&hei=284,"3 years GuaranteeFeatures and benefitsIdeal for professionals and DIY enthusiasts in equal measure, the cantilever organizer expertly combines a compact construction with a convenient multi-level system. It has a clear lid and 18 removable bins that come in two sizes, making it a perfect choice for storing small or medium sized componentsHeavy-duty construction featuring a non-breakable polycarbonate lid, metal latches and a sturdy metal handle for more durabilityThe multi-level design offers easy access to contentsMultiple sized removable bins allow for efficient tool and small parts organizationEasy to transport thanks to the compact and lightweight design",BQ
5145,Stanley Sortmaster Black & yellow 10 compartment Organiser,11.33,Tool storage,https://www.diy.com/departments/stanley-sortmaster-black-yellow-10-compartment-organiser/1026435_BQ.prd,https://media.diy.com/is/image/Kingfisher/mac-allister-black-grey-18-compartment-organiser~3663602905325_04bq?wid=284&hei=284,"Single organiser with removable inserts and innovative locking system. Allows the connection and transport of up to 3 individual organisers.Stackable removable compartments, heavy duty latches and clear polycarbonate impact resistant lid",BQ
5145,Stanley Sortmaster Organiser,20.39,Tool storage,https://www.builderdepot.co.uk/stanley-sortmaster-organiser,"https://www.builderdepot.co.uk/media/catalog/product/l/0/l018444_s_01_bb61.jpg?quality=80&bg-color=255,255,255&fit=bounds&height=400&width=400&canvas=400:400",The Stanley Sortmaster Organiser offers a great deal of storage flexibility. Removable dividers allow a combination of tools and small parts storage. It has a special lid structure where the upper ribs interlock with inner dividers keeping small parts in place and preventing movement from one compartment to another. A top lid lock keeps contents secure inside.Key FeaturesStorage flexibilityRemovable dividersSpecial lid structure where the upper ribs interlock with inner dividersTop lock,Builderdepot
5145,Stanley Sortmaster,11.00,Tool storage,https://www.homebase.co.uk/stanley-sortmaster/12823402.html,https://static.thcdn.com/images/xsmall/webp//productimg/original/12823402-8774831882072464.jpg,"The Stanley Sortmaster organiser is a sturdy tool and accessories organiser which is perfect for any job, it has removable dividers and many possible configurations making it the most flexible of storage solutions. The special lid structure keeps the small parts in place and prevents movement from one compartment to another and the unique angled corners can accommodate angled tool such as hammers or screw drivers. Moveable dividers provides high customization for small parts and larger hand tools Secure locking latches allows secured stacking and transport of up to 3 at once Special lid structure prevents movement of small parts from one component to another",Homebase
5146,Erbauer Connecx Modular Storage Plastic & steel 6 compartment Tool case set,35.00,Tool storage,https://www.diy.com/departments/erbauer-connecx-modular-storage-plastic-steel-6-compartment-tool-case-set/5059340164427_BQ.prd,https://media.diy.com/is/image/Kingfisher/stanley-sortmaster-black-yellow-10-compartment-organiser~3253561707209_01bq?wid=284&hei=284,"This Erbauer solid top organiser has a compact design featuring 6 removable compartments making it easy to customise and organise your tool accessories with a larger central storage area for equipment and materials.Compatible with all Erbauer Connecx Modular Storage System productsGuarantee - 5 yearsPadlockableIncludes Carrying handlesFeatures and benefitsThe organiser is IP rated and equipped with an integrated seal, protecting contents from both dust and water. The stackable design enables this organiser to be compatible with all Erbauer, Connecx modular storage system products to build and customise your own system. Quality assured with a 5-years guarantee.Stackable design ensures compatibility with all Erbauer Connecx Modular Storage System products, to build and customise your own system. Multiple configurations available to suit your needsFeatures an extra large storage capacityHolds and carries up to 30kg of tool accessories and hardwareIntegrated IP55 rated seal, protecting the contents from both dust and waterCan be secured with a padlock or when stacked as part of the Erbauer, Connecx system with a central locking bar to secure all productsIncludes 6 removable compartments, making it easy to customise and protect your tool accessories with a larger storage area for equipment and materialsMade from up to 60% recycled materialsQuality assured with a 5-years guarantee",BQ
5147,Mac Allister Aluminium 24 compartment Trolley & toolbox (H)670mm (W)225mm (D)370mm,75.00,Tool storage,https://www.diy.com/departments/mac-allister-aluminium-24-compartment-trolley-toolbox-h-670mm-w-225mm-d-370mm/1345838_BQ.prd,https://media.diy.com/is/image/Kingfisher/erbauer-connecx-modular-storage-plastic-steel-6-compartment-tool-case-set~5059340164427_01c?wid=284&hei=284,"Suitable tools storage and mobile, this grey aluminium mobile storage case that comes with 24 compartments, a large cushion handle and a lid included.Guarantee - 3 yearsFeatures and benefitsDurable & strong aluminium frame with metal cornersTrolley system for easy transportWith two sections for different types of storage purposeEasy organisation and storage with four cantilever trays equipped with dividersBottom section equip with one big tray, fit with the removable divider for easy adjustmentTop section, strong carrying shoulder strap and handle with cushion, both equip with comfortable cushion pad",BQ
5148,Stanley Toolbox trolley,34.00,Tool storage,https://www.diy.com/departments/stanley-toolbox-trolley/66293_BQ.prd,https://media.diy.com/is/image/Kingfisher/mac-allister-aluminium-24-compartment-trolley-toolbox-h-670mm-w-225mm-d-370mm~3663602904960_02bq?wid=284&hei=284,"Suitable for bulky materials and equipment, this black, silver & yellow plastic mobile workshop that comes with 4 compartments, a telescopic handle and a lid included.Features and benefitsEasily comes apart into 2 separate unitsFor storing tools or arts and craft materialsGiant lower bin ideal for bulky materials and equipment; separable upper bin; swivel draw organising compartment; top level tool trayRemovable tote tray",BQ
5148,Stanley Tool Tote and Organiser Toolbox - 19 Inch,35.00,Tool storage,https://www.homebase.co.uk/stanley-tool-tote-and-organiser-toolbox-19-inch/12807317.html,https://static.thcdn.com/images/xsmall/webp//productimg/original/12807317-1994831909376637.jpg,"The Stanley 19 inch tool tote and organiser toolbox is ideal for storing power tools, hand tools and includes sections for small parts storage.",Homebase
5148,"Stanley Essential Toolbox Metal Latch 26""",31.99,Tool storage,https://www.toolstation.com/stanley-essential-toolbox-metal-latch/p77807,https://cdn.aws.toolstation.com/images/141020-UK/250/95193.jpg,"Provides safe storage for all essentials, from tools and accessories, to fixings and fasteners.• Innovative design• Robust structure• Large volume storage• Ergonomic metal latches• Organiser lid for small parts• Padlock eye gives option for full locking",Toolstation
5148,Stanley FatMax 1-93-935 Waterproof Toolbox - 28in,36.00,Tool storage,https://www.wickes.co.uk/Stanley-FatMax%C2%AE-1-93-935-Waterproof-Toolbox---28in/p/117809,https://media.wickes.co.uk/is/image/wickes/S9823_117809_00?$normal$,"The Stanley FatMax® 1-93-935 28 inch structural foam tool box is a heavy-duty water proof toolbox suitable for any conditions, it features a portable ¾ length tote tray and 32L of storage in total. It has an all-round water seal making it waterproof and is constructed from structural foam with large rust proof metal hinges. There is an integrated V groove in the top lid which is suitable for sawing work for pipes and lumber.Innovative design - robust structure; large storage volume of 32L Extra wide soft grip handle on top for easy lifting Removable tray allows enough space for larger tools to be stored underneath Constructed of structural foam for extra strength Large metal rust proof latches with padlock for locking possibilitie Integrated V-Groove on top lid for sawing work needed, suitable for working with pipes and lumber Tough Ergonomic soft grip handle allows heavy loads to be carried with ease Tools not included and are available separately ",Wickes
5149,Stanley Polypropylene (PP) Toolbox (L)665mm (H)350mm,20.00,Tool storage,https://www.diy.com/departments/stanley-polypropylene-pp-toolbox-l-665mm-h-350mm/3253561829765_BQ.prd,https://media.diy.com/is/image/Kingfisher/stanley-toolbox-trolley~3253561939686_03bq?wid=284&hei=284,"This toolbox from Stanley is ideal for storing all your tools, fixings and accessories and has a load capacity of 25kg.Includes Carrying handlesFeatures and benefitsTop organisers allow for smart storage of small partsAn internal tote tray ideal for storing smaller hand tools. The tray can also be removed to store larger tools underneathMetal rust-proof latches for durability and a padlock eye for securityStrong and durable, yet lightweight and easy to carry",BQ
5150,Stanley FatMax Open tote (L)340mm,45.00,Tool storage,https://www.diy.com/departments/stanley-fatmax-open-tote-l-340mm/1820386_BQ.prd,https://media.diy.com/is/image/Kingfisher/stanley-polypropylene-pp-toolbox-l-665mm-h-350mm~3253561829765_01c_bq?wid=284&hei=284,"Keep your tools tidy and make them easy to transport with this heavy duty weatherproof open tote. With 22 compartments, it's great for organising your tools and equipment.Guarantee - 1 yearFeatures and benefitsWaterproof & Rigid Plastic BottomExtra tough fabricHeavy duty steel handle with rubber gripMultiple use tool compartments for all storage needs with easy access pockets",BQ
5150,Stanley FatMax Open Mouth Rigid Tool Bag,40.00,Tool storage,https://www.homebase.co.uk/stanley-fatmax-open-mouth-rigid-tool-bag/12819546.html,https://static.thcdn.com/images/xsmall/original//productimg/original/12819546-1234846171299813.jpg,"The Stanley FatMax 18’’ Open Mouth Rigid Tool Bag is made of durable materials for internal protection against tool damage. The injected polypropylene bottom protects against dirt andmoisture. The ergonomic padded shoulder strap and rubber grip handle allows for easier carrying of heavier loads. The open mouth design with tool compartments, storage loop and vertical pockets provides a quick and convenient storage solution. Innovative design providing large capacity and easy access to contents Ergonomic design with padded shoulder strap and rubber grip handle for comfortable carrying of heavy loads Vertical storage pockets allow quick and easy tool access Multiple use compartments for all storage needs Solid base protects from moisture and dirt",Homebase
5150,STANLEY FATMAX PROSTACK Open Tote Toolbox,31.00,Tool storage,https://www.wickes.co.uk/STANLEY-FATMAX-PROSTACK%E2%84%A2-Open-Tote-Toolbox/p/249896,https://media.wickes.co.uk/is/image/wickes/GPID_5000008798_00?$normal$,"STANLEY FATMAX PROSTACK™ Open Tote is a 21.6 litre capacity toolbox (440 x 275 x 320 mm) that is part of STANLEY FATMAX PROSTACK™ interlocking, stackable, portable storage system, offering real versatility whatever the task. Packed full of user-friendly features, the PROSTACK™ system is the perfect partner to help you get the job done quickly and professionally. Each PROSTACK™ unit features a strong interlocking catch system to let you connect and disconnect units quickly and easily, allowing you to build a storage system that is bespoke to you and your trade. STANLEY FATMAX PROSTACK™ Open Tote tool box provides the perfect storage solution for power and hand tool storage, designed with a large opening for easy access to tools and other accessories, featuring a folding bi-material carrying handle for comfort and portability, a padlock eye for safe storage on site or in the workshop.Part of the interlocking, modular PROSTACK™ storage system. Build a versatile and convenient storage solution that is personalised to your trade with multiple module and transport options The STANLEY FATMAX PRO-STACK™ Open Tote tool box provides the perfect storage solution for power tools and hand tools Large opening for easy access to tote contents Folding bi-material carry handle for comfort and easy transportation Durable plastic side latches allow for connectivity to multiple PROSTACK™ modules Entirely compatible with the existing STANLEY® TSTAK™ range of modular storage solutions 21.6 litre volume with 20kg load capacity ",Wickes
5151,Mac Allister 570mm Plastic 11 compartment Cantilever toolbox,32.00,Tool storage,https://www.diy.com/departments/mac-allister-570mm-plastic-11-compartment-cantilever-toolbox/1511734_BQ.prd,https://media.diy.com/is/image/Kingfisher/stanley-fatmax-open-tote-l-340mm~3253561813214_01c_bq?wid=284&hei=284,"This cantilever tool box is ideal for storing and transporting power tools, hand tools and small parts.Guarantee - 3 yearsIncludes Carrying handlesFeatures and benefitsDesigned with professionals in mind, the cantilever tool box 22 will also suit DIYers who are looking for a heavy-duty tool box to securely transport power tools and small parts. Part of the cantilever series, this tool box comes with a convenient organizer for small and medium sized components and 11 removable bins in two sizes. The lower compartment is spacious, so you can easily store larger power tools and bulkier items as well as hand tools. Made with a double wall construction the tool box is built to lastConvenient tool box that comes with an organizer for small and medium sized components and a spacious interior for larger power tools and bulkier itemsCantilever design allows easy access to all contents, as the tool box opens horizontallyClear lid lets you see the contents of the organizer at a glance, while its polycarbonate material keeps them protectedBack support legs provide optimum support and maintain the tool box stable while it's openSturdy handle with a comfortable soft grip for easier transportation. Metal latches keep the contents secure while you haul the tool box around your work spaceLarge compartment for power and hand tools, long compartment for screwdrivers and 11 removable bins for small parts",BQ
5152,"10W Rechargeable Work light, 1000lm",26.00,Torches & worklights,https://www.diy.com/departments/10w-rechargeable-work-light-1000lm/5059340201153_BQ.prd,https://media.diy.com/is/image/Kingfisher/10w-rechargeable-work-light-1000lm~5059340201153_01c?wid=284&hei=284,Guarantee - 2 yearsFeatures and benefits800 lumens rechargeable work light. IP65 rated. Suitable for indoor or outdoor environment,BQ
5152,Luceco USB Rechargeable Work Bar LED Light 10W 1000Lm,41.99,Torches & worklights,https://www.jewson.co.uk/p/luceco-usb-rechargeable-work-bar-light-10w-1000lm-LIL64460,"https://media.jewson.co.uk/f_auto,q_auto/t_Regular/global/product-images/LIL64460","The Luceco USB Rechargeable Work Bar Light 10W 1000Lm offers an impressive 1000 lumens, the super bright LED light is ideal for night time projects or projects with limited visibility. It is rechargable, corrosion resistant and comes with hooks and swivel magnets for hands-free use.Features & benefitsCorrosion resistantUSB ChargerLEDIntegrated Hooks12v Car charger",Jewson
5153,"20W Rechargeable Work light, 2000lm",39.00,Torches & worklights,https://www.diy.com/departments/20w-rechargeable-work-light-2000lm/5059340201160_BQ.prd,https://media.diy.com/is/image/Kingfisher/10w-rechargeable-work-light-1000lm~5059340201153_01c?wid=284&hei=284,Guarantee - 2 yearsFeatures and benefits1600 lumens rechargeable work light. IP65 rated. Weather resistant design makes it a fit choice for harsh site conditions,BQ
5154,10W Corded Work light,16.00,Torches & worklights,https://www.diy.com/departments/10w-corded-work-light/5059340201146_BQ.prd,https://media.diy.com/is/image/Kingfisher/20w-rechargeable-work-light-2000lm~5059340201160_01c?wid=284&hei=284,"Guarantee - 2 yearsCE markedFeatures and benefits800 lumens corded work light, IP65 rated. Suitable for indoor or outdoor environment",BQ
5155,"Nebo Big Larry 2 1.87V 1.87W Cordless Integrated LED Non-rechargeable Work light, 500lm",14.99,Torches & worklights,https://www.diy.com/departments/nebo-big-larry-2-1-87v-1-87w-cordless-integrated-led-non-rechargeable-work-light-500lm/5060063228563_BQ.prd,https://media.diy.com/is/image/Kingfisher/10w-corded-work-light~5059340201146_01c?wid=284&hei=284,Guarantee - 2 yearsFeatures and benefits500 lumens with the COB work light and 200 lumens from the top flashlightThe red COB light is perfect for distress signaling or roadside emergencies The steel clip and magnetic base provide convenient hands-free lighting optionsAnodised aircraft grade aluminium; water and impact resistant IPX4Fully dimmable - Memory power setting,BQ
5156,Erbauer EXT LED Work light 2000lm,46.00,Torches & worklights,https://www.diy.com/departments/erbauer-ext-led-work-light-2000lm/5059340159706_BQ.prd,https://media.diy.com/is/image/Kingfisher/nebo-big-larry-2-1-87v-1-87w-cordless-integrated-led-non-rechargeable-work-light-500lm~5060063228563_03c_bq?wid=284&hei=284,"Guarantee - 3 yearsIncludes IP20 cable with UK plug 1.5mFeatures and benefitsThis robust and modern work light offers the convenience of two power options: Cordless or corded operation. It is compatible with the batteries from the Erbauer tools range. If the battery is getting low, you can switch it with the supplied cable and continue to work. You no longer need to worry about working in the dark. It provides perfect lighting for a high range of uses in both outdoor and indoor work areas. And thanks to rotative function you can focus the light to specific areasThis work light is compatible with any battery from the Erbauer range. Simply remove the battery from any tool and insert it into the work lightIf the battery (sold separately) is low, the cable included allows you to continue your work. Just remove the battery and insert the cable into a socketWith his 1600 lumens (20W) this work light truly meets your needs. It is providing you a very comfortable and quality light for better work conditions and a better precision levelNo matter where it is positioned, with his 300° rotation and 11 notches of orientation. You will be able to have its bright lights hit your job from the perfect angle",BQ
5156,Erbauer  Rechargeable LED Work Light with USB with Power Bank 2000lm,39.98,Torches & worklights,https://www.screwfix.com/p/erbauer-rechargeable-led-work-light-with-usb-with-power-bank-2000lm/339pg,https://media.screwfix.com/is/image/ae235/339PG_P?$autoprodblock$=&wid=136&hei=136&dpr=on,"Cordless rechargeable LED work light offering 300° rotation with 11 position settings. Ergonomic, portable design. In closed position, the optical compartment is protected for safe storage. Offers versatility in the workplace with 2 foldable hooks and 2 wall fixing holes. USB-A output is suitable for charging mobile phones and tablets (USB cable not included).IP54: For Indoor & Outdoor UseAdjustable1 x 2A Type A USB2000lmPlastic BodyDrop Impact-ResistantUp to 6 Hours Run Time5 Hours Charge TimeUp to 30,000 Hours LifeAdaptor & Car Charger Included",Screwfix
5157,Diall Black Rechargeable 120lm LED Torch,16.00,Torches & worklights,https://www.diy.com/departments/diall-black-rechargeable-120lm-led-torch/1370097_BQ.prd,https://media.diy.com/is/image/Kingfisher/erbauer-ext-led-work-light-2000lm~5059340159706_01c?wid=284&hei=284,The perfect spotlight to keep inside the house for an emergency or use for every day jobs.Comes with AC chargerFeatures and benefitsNon-replaceable energy saving long life LED,BQ
5157,Diall   LED Head Torch Black 120lm,6.98,Torches & worklights,https://www.screwfix.com/p/diall-led-head-torch-black-120lm/394kk,https://media.screwfix.com/is/image/ae235/394KK_P?$autoprodblock$=&wid=136&hei=136&dpr=on,"Comfortable design that adjusts to head shape and fits both adults and children. The light itself can swivel and rotate up to 180° which makes it ideal for indoor and outdoor use. Includes 3 x AAA batteries and is perfect for camping, hiking, walking, running, fishing, exploring and auto repair.Beam Projects Up to 50mAdjustable Nylon HeadbandNot Water-ResistantNo Impact ResistanceBattery Lasts up to 4 Hours120lm180° Beam Angle2m Drop HeightABS Construction",Screwfix
5158,Diall Rechargeable 190lm LED Battery-powered Spotlight torch,20.00,Torches & worklights,https://www.diy.com/departments/diall-rechargeable-190lm-led-battery-powered-spotlight-torch/5059340146904_BQ.prd,https://media.diy.com/is/image/Kingfisher/diall-black-rechargeable-120lm-led-torch~3663602901976_05c?wid=284&hei=284,"Function(s)-Rechargeable with rotating handle and standGuarantee - 2 yearsCE markedDo not look directly at the lightFeatures and benefitsThis rechargeable Diall spotlight is designed to be light and compact, making it perfect for a wide range of heavy-duty activities both indoors or outdoors.Comfortable handle design for better handling and transport",BQ
5159,"Diall 10lm LED Battery-powered Push light, Pack of 3",10.00,Torches & worklights,https://www.diy.com/departments/diall-10lm-led-battery-powered-push-light-pack-of-3/5059340146959_BQ.prd,https://media.diy.com/is/image/Kingfisher/diall-rechargeable-190lm-led-battery-powered-spotlight-torch~5059340146904_01c?wid=284&hei=284,Non-dimmableFunction(s)-Back adhesive and indoorGuarantee - 2 yearsNot water resistantNot resistant to impactCE markedDo not look directly at the lightFeatures and benefitsThis stylish pack of 3 push lights can be stuck to most surfaces and be used to instantly light up darker areas in the home,BQ
5160,Nebo 400lm White LED Head lamp,14.99,Torches & worklights,https://www.diy.com/departments/nebo-400lm-white-led-head-lamp/5060063228587_BQ.prd,https://media.diy.com/is/image/Kingfisher/diall-10lm-led-battery-powered-push-light-pack-of-3~5052931193141_01c_bq?wid=284&hei=284,"The MYCRO Headlamp is a rechargeable headlamp and cap light that includes an adjustable head strap. Small enough to fit in the palm of your hand, this powerful light features an impressive 400 lumen Turbo Mode.Rechargeable battery includedDimmableGuarantee - 2 yearsComes with Headstrap, USB charge leadFeatures and benefitsThe Mycro Headlamp features dual green and red LED chips, with a direct-to-red feature for stealth viewing.USB rechargeableSPC (Smart Power Control)Water (IPX4) and impact-resistantBattery charging indicator allows you to see exactly how much life you have left in the headtorchThe integrated tilt feature allows you to position the beam exactly where you want it",BQ
5161,Stanley 3.7V 20W Cordless Integrated LED Rechargeable Work light,45.00,Torches & worklights,https://www.diy.com/departments/stanley-3-7v-20w-cordless-integrated-led-rechargeable-work-light/5020024901720_BQ.prd,https://media.diy.com/is/image/Kingfisher/nebo-400lm-white-led-head-lamp~5060063228587_01c?wid=284&hei=284,Guarantee - 1 yearFeatures and benefitsStanley 20w Rechargeable LED Worklight20w Integral LED Light3000 Lumens6000k Colour TemperatureIP65,BQ
5162,Goodyear Rechargeable Head Light Torch,14.99,Torches & worklights,https://www.diy.com/departments/goodyear-rechargeable-head-light-torch/5055441436890_BQ.prd,https://media.diy.com/is/image/Kingfisher/stanley-3-7v-20w-cordless-integrated-led-rechargeable-work-light~5020024901720_01c?wid=284&hei=284,"Guarantee - 1 yearFeatures and benefitsGenuine 6000 Lumen T6 CREE LED, Rechargeable Lithium-Ion BatteryMultiple LED mode settings for light intensity and flashing, Reflector flat lense gives you high definition coverageAdjustable beam angle, point it straight ahead or on the floor - multi-point anglesMultiple Zoom Levels - X1 / X250 / X500 / X1000 / X2000Made of aluminium, alloy and hard reinforced plastic making it extremely durableFully adjustable head straps, Waterproof design - protection against rain, Safety rear red LED to prevent accidentsIncludes rechargeable batteries and charger - Operating time (when fully charged) - 5 HoursClear plastic RIM is not included.(that is for illustration purpose only)",BQ
5163,Diall Black Inspection light 60W 220-240V,12.00,Torches & worklights,https://www.diy.com/departments/diall-black-inspection-light-60w-220-240v/1354686_BQ.prd,https://media.diy.com/is/image/KingfisherDigital/goodyear-rechargeable-head-light-torch~5055441436890_01c_MP?wid=284&hei=284,This inspection light adds additional lighting to your work areas. Suitable for home and workshop and comes with a 5000mm long cable.Features and benefitsComes with a hook to hang the light securely in position,BQ
