id,name,price,category,link,image,description,source
52,Hyundai Silent 230V 24L Corded Compressor HY7524,150.00,Air compressors,https://www.diy.com/departments/hyundai-silent-230v-24l-corded-compressor-hy7524/5056275722722_BQ.prd,https://media.diy.com/is/image/Kingfisher/hyundai-silent-230v-24l-corded-compressor-hy7524~5056275722722_01c_bq?wid=284&hei=284,"The HY7524 is a powerful yet compact 750w direct-drive oil-free low noise air compressor from Hyundai. Designed for DIY and trade applications the HY7524 silenced oil-free air compressor is ideal for spray-painting, blowing away dirt and dust, nailing, inflating tyres or operating air tools.Guarantee - 2 yearsComes with HY7524 electric air compressor, user manual, warranty cardFeatures and benefitsWeighing only 22kg the HY7524 whisper compressor is lighter than your conventional piston type air compressor and is completely oil-free, so there is no risk of oil contamination in the air supply.Low noise air compressorOil free - maintenance free and no oil contaminationHyundai 750w / 230v direct drive electric motor with UK 3-pin 13amp plug.24 litre tank capacity provides an air displacement of 5.2CFM / 150 litres per minute and a maximum pressure of 100psi / 7barPressure regulator with twin pressure gauges and twin quick release ‘Euro’ type air connectors and water / condensation trap. Includes automatic cut out switch, safety valve and pressure regulator.",BQ
53,Hyundai Silent 230V 8L Corded Compressor HY5508,120.00,Air compressors,https://www.diy.com/departments/hyundai-silent-230v-8l-corded-compressor-hy5508/5056275722715_BQ.prd,https://media.diy.com/is/image/Kingfisher/hyundai-silent-230v-24l-corded-compressor-hy7524~5056275722722_01c_bq?wid=284&hei=284,"The HY5508 is a powerful yet compact 550w direct-drive oil-free low noise air compressor from Hyundai. Designed for DIY and light applications the HY5508 silenced oil-free air compressor is ideal for air brushing, blowing away dirt and dust, nailing, inflating tyres & inflatables or operating air tools.Guarantee - 2 yearsComes with HY5508 electric air compressor, user manual, warranty cardFeatures and benefitsWeighing only 15kg the HY5508 whisper compressor is lighter than your conventional piston type air compressor and is completely oil-free, so there is no risk of oil contamination in the air supply. The HY5508 features 4 robust rubber mounted feet and a carry handle for easy manoeuvrability. Powered by a 550w motor directly connected to the oil-less air compressor pump and rubber mounted for low vibration, makes it ideal for the home, light workshop or garage use and is powered by standard mains 230v supply. This maintenance-free compressor uses an oil-free diaphragm pump to produce a clean air supply and considerably reduce noise compared to conventional piston compressors.Hyundai's Silent 8 Litre Small Air Compressor- OIL Free Operation & Duty cycle of 25%.Powered By: 550 Watt, 230V Electric-Direct Drive Motor, Coupled With A UK 3-Pin, 13 Amp Plug , Suitable for Home or Workshop Use.Hyundai's HY5508 Silent Air Compressor Provides an Air Displacement of 4 CFM or 120 Litres / Minute at 100 PSI. Ideal For Air Brush Spraying And Home UseSuperior Design: Fitted with An Automatic Cut Out Switch, Air Release and Euro Quick-Release Air Connections For All User RequirementsUltra Lightweight & Manoeuvrable: The Air Compressor Weights Just 15KG - Coupled With 4 Robust Rubber Feet & Carry Handle It's Hyundai's Alternative for a Portable Yet Powerful Compressor",BQ
54,Stanley DST 100/8/6/SI 6L Silent Air Compressor,159.00,Air compressors,https://www.diy.com/departments/stanley-dst-100-8-6-si-6l-silent-air-compressor/8016738772418_BQ.prd,https://media.diy.com/is/image/Kingfisher/hyundai-silent-230v-8l-corded-compressor-hy5508~5056275722715_01c_bq?wid=284&hei=284,"The Stanley compressor Silent DST 100/8/6 has a 6 liter tank with a working pressure of 8 bar. The biggest advantage of the compressor is that it produces a maximum of 59 dB. As a result, it is always whisper quiet. Use the Stanley compressor in combination with all the different pneumatic tools from Stanley.Guarantee - 1 yearFeatures and benefitsTank capacity: 6 liters
Intended Use:Inflatable Item, Paint Gun, Grease Gun, Tires, Fluid Gun, Tacker, Caulking Gun, Sandblaster
Power source: Mains voltageUltra-silent compressor for home and professional usePortable and compact, it can be used and stored even in small spacesHeavy-duty plastic shrouds protect the internal mechanical parts",BQ
55,Scheppach HC51V 1500W 50 LTR Air Compressor - Oil Free,199.98,Air compressors,https://www.diy.com/departments/scheppach-hc51v-1500w-50-ltr-air-compressor-oil-free/4046664063674_BQ.prd,https://media.diy.com/is/image/KingfisherDigital/stanley-dst-100-8-6-si-6l-silent-air-compressor~8016738772418_01c_MP?wid=284&hei=284,"Guarantee - 1 yearComes with Supplied with HC51V compressor : 1 x carry handle, wheel set (pair), rubber feet x 1, fixing bolts, instructionsFeatures and benefitsCompact and portable, the HC51V is a verticle air compressor that offers a perfect combination of performance and mobility in the one unit. It features a powerful 2.0 hp motor, 24 litre tank capacity, and with a maximum 10 bar operating pressure. It also features two quick release couplings to supply air to 2 x air tools at the same time. The ideal machine for operating such air tools as staplers, nailers, ratchets, impact wrench, air hammer, paint spraying, tyre inflation, and blow cleaning. A perfect partner for maintenance jobs in the workshop, garage, garden, and around the home.Powerful 1500 W motor50 Litre capacity air tank10 bar / 145 psi max. operating pressure180 L/min air intake capacityLong life oil free air pumpBuilt-in remote pressure regulator2 x quick release couplerLong life oil-free air pump - Maintenance free",BQ
56,Black + Decker 195/6 NK Air Compressor,125.00,Air compressors,https://www.diy.com/departments/black-decker-195-6-nk-air-compressor/8016738766950_BQ.prd,https://media.diy.com/is/image/KingfisherDigital/scheppach-hc51v-1500w-50-ltr-air-compressor-oil-free~4046664063674_01c_MP?wid=284&hei=284,"This compressor sucks in enough air to perform the necessary work. Think of inflating an air mattress or bicycle tire, or using a tacker. But this model also inflates your car and/or motorcycle tires in no time. It is a handy and beautifully designed compressor that stands its ground.Guarantee - 1 yearFeatures and benefitsTank capacity: 6 liters
Intended Use: Inflatable Item, Paint Sprayer, Liquid Sprayer, Sandblaster
Power source: Mains voltage
Pump capacity: 180 L/minVersatile and easy to use, ideal for all hobby and semi-professional applicationsCompact machineExternal pump for better coolingCompact ON/OFF KnobEasy to handle thanks to built-in metal handle",BQ
57,BOSCH EasyPump Cordless Pneumatic Air Pump (0603947000),89.95,Air compressors,https://www.diy.com/departments/bosch-easypump-cordless-pneumatic-air-pump-0603947000-/3165140997010_BQ.prd,https://media.diy.com/is/image/KingfisherDigital/black-decker-195-6-nk-air-compressor~8016738766950_01c_MP?wid=284&hei=284,"BOSCH EasyPump Cordless Pneumatic Air Pump (0603947000)Guarantee - 1 monthFeatures and benefitsBOSCH EasyPump Cordless Pneumatic Air Pump (0603947000)Inflation of up to 10.3 bar with real-time measurement and pre-select functionIdeal for inflating tyres (car, motorcycle, bike), balls, and smaller water sports equipmentEverything ready at hand: various adapters are neatly stored in the tool handle, Intuitive and practical: easy-to-use, ergonomic, and small design with big displayIntegrated battery and USB-C charging, brightly illuminated by LED lightMax. pressure: 150 PSI / 10.3 bar / 1050 kPa",BQ
58,2HP 50 Litre 10 Bar Oil Free Compressor,230.00,Air compressors,https://www.diy.com/departments/2hp-50-litre-10-bar-oil-free-compressor/4006825597295_BQ.prd,https://media.diy.com/is/image/KingfisherDigital/bosch-easypump-cordless-pneumatic-air-pump-0603947000-~3165140997010_01c_MP?wid=284&hei=284,"The TC-AC 240/50/10 OF is a versatile compressor which, with its space-saving design, no workshed or garage should be without.Guarantee - 2 yearsFeatures and benefitsThe TC-AC 240/50/10 OF is a versatile compressor which, with its space-saving design, no workshed or garage should be without. It has a pressure reducer for working pressure adjustment up to 10 bar and provides excellent service in a large number of compressed air jobs. Its oil-free pump works without lubrication and therefore requires very little maintenance. This means that the compressor can be transported in any position. The controlled working pressure of the compressor is indicated by a pressure gauge and tapped through a quick-lock coupling. For mobility and easy transportation there is a holding bar and large wheels. The condensate is drained from the tank through the drain plug, making maintenance user-friendly. Vibration-absorbing feet prevent mechanical shocks and reduce noise generation. For the best possible user safety there is a non-return valve and a safety valve. A holder also ensures that the accessories can be tidily stored at all times. The solid, long-lasting 50 litre tank holds generous reserves for long work sessions and comes with a 10-year warranty against perforation corrosion of the tank.Oil-free, service-free motor for little maintenanceThe 50 litre tank offers plenty of air reservesCompact, space-saving designApplications up to 10 bar can be set using the pressure reducerPressure gauge & quick-release coupling for regulated pressureLarge wheels and holding bar for easy transportConvenient storage of accessories thanks to the holderVibration-absorbing feet ensure stability",BQ
59,"Hyundai 150 Litre Air Compressor, 14CFM/145psi, Twin Cylinder, Belt Drive 3hp HY3150S",530.99,Air compressors,https://www.diy.com/departments/hyundai-150-litre-air-compressor-14cfm-145psi-twin-cylinder-belt-drive-3hp-hy3150s/5056275722753_BQ.prd,https://media.diy.com/is/image/KingfisherDigital/2hp-50-litre-10-bar-oil-free-compressor~4006825597295_01c_MP?wid=284&hei=284,"Electric Air Compressor
The HY3150S is an electric air compressor from Hyundai. Designed for professional workshops and trade applications, the HY3150S air compressor is perfect for workshops and commercial garages for use for spray-painting, operating air tools and inflating tyres.

Professional Use Compressor
Weighing 117kg, the HY30150S features four anti-vibration rubber feet. The 3hp electric motor can be powered by a standard 13amp UK 3-pin plug, making it ideal for a professional workshop or home garage use.

150 Litre Air Compressor
The large 150-litre tank capacity provides a constant 14cfm supply of air. Twin Q/R ‘Euro’ type air outlets on the compressor increase versatility and allow two air-lines or tools to be connected at the same time.

Low Noise
Operating at a maximum of 75dB and standing on anti-vibration mounts, this product is ideal for the home, workshop or garage use, or anywhere where there are conventional residential power sockets available.Guarantee - 2 yearsComes with a User ManualFeatures and benefitsAutomatic Cut Out
The automatic pressure cut-out switch provides user safety with a built-in safety valve and pressure regulator with twin gauges, giving the user-controlled variable air pressure.

This air compressor provides a fantastic combination of performance and durability ideal for professional applications in any workshop.

Note on compressor care: Pressure safety valves on Hyundai air compressors have been updated in compliance with the latest CE certification standards. The pressure release pull ring has been removed from the safety valve to prevent it from being misused to drain the air from the compressor tank, causing excessive wear to the valve.

Air and moisture should always be released daily using the drain valve located on the bottom of the tank.

Check the belt tension and condition weekly and ensure there are no air leaks from hoses and fittings, as this will greatly increase the electricity used to maintain constant air pressure.

This air compressor provides a fantastic combination of performance and durability ideal for professional applications in any workshop.

2.2kW/3hp Single Phase
The HY3200S compressors have a 2.2kw/2200w/3hp single phase, 230v 50hz electric motor. They are supplied with a 13amp 3 pin plug. The 13 amp plug will be fine for normal DIY use. However, if the air compressor is being used for more than a 50% duty cycle (motor running for more than half the time) it may be advisable to use a blue 16 amp plug.Strong performance: The HY3150S is a powerful 3hp twin cylinder cast iron belt drive electric air compressor which has been designed for professional workshop and garage use, offering a massive 2200W of power.Low noise: This Hyundai low-speed electric air compressor runs at a low decibel (75dB) and sits on anti-vibration mounts, so is perfect for use in any size space.Superior design: The twin-cylinder, slow-running pump with cast iron cylinders promotes longevity and the aluminium cylinder head encourages improved cooling - together, these produce a maximum working pressure of 145psi/10bar.Multi-use: This electric air compressor is ideal for DIY and commercial use for spray-painting, blowing away dirt and dust, nailing, inflating tyres or operating air tools.Invest in the best: Hyundai is a brand you can trust, For your peace of mind, this Hyundai air compressor is also covered by a 2 year Hyundai warranty, as well as full UK service and parts to maintain it for years to come.",BQ
60,Scheppach HC26 1500W 24 LTR Air Compressor,144.99,Air compressors,https://www.diy.com/departments/scheppach-hc26-1500w-24-ltr-air-compressor/4046664072980_BQ.prd,https://media.diy.com/is/image/KingfisherDigital/hyundai-150-litre-air-compressor-14cfm-145psi-twin-cylinder-belt-drive-3hp-hy3150s~5056275722753_01c_MP?wid=284&hei=284,"Guarantee - 1 yearComes with Supplied with HC26 compressor : 1 x wheel set (pair), rubber feet x 1, fixing bolts, 1 x air filter, 1 x 280 ml sae 5W-40 compressor oil, instructionsFeatures and benefitsDesigned for the home user for light and light occasional use, the HC26 is an affordable air compressor that combines performance and safety in the one unit .  It features a powerful 2.0 hp motor, 24 litre air receiver, 8 bar maximum operating pressure, and has a 220 L/min air flow intake with sufficient power to opperate a variety of tools. This Scheppach compressor is the perfect partner for occasional paint spraying, tyre inflation, blow cleaning, stapling and all those maintenance jobs in the garage, garden and around the home. Supplied with ultra performance long life SAE 5W-40 compressor oil (280 ml).Powerful 1500 W motor24 Litre capacity air tank8 bar / 115 psi max. operating pressure220 L/min air intake capacityOil lubricated - low maintenance pumpBuilt-in remote pressure regulator1 x quick release couplerIntegrated carry handle",BQ
61,Goodyear 12V Portable Car Tyre Inflator Compressor 3M Cigarette Lighter Cord,14.99,Air compressors,https://www.diy.com/departments/goodyear-12v-portable-car-tyre-inflator-compressor-3m-cigarette-lighter-cord/5054242005076_BQ.prd,https://media.diy.com/is/image/KingfisherDigital/scheppach-hc26-1500w-24-ltr-air-compressor~4046664072980_01c_MP?wid=284&hei=284,"Includes an integrated 3 metre cord with cigarette lighter plug allowing you to inflate tyres on most carsGuarantee - 1 yearFeatures and benefitsEasy to read gauge with both PSI and BAR measurements, making this UK and EU compliantPowered by a standard12v car cigarette lighter socketIncludes an integrated 3 metre cord with cigarette lighter plug allowing you to inflate tyres on most cars33cm premium quality leak-free air hose3 X Inflation accessories allowing you to fill  air in inflatable toys / inflatable swimming pools / Footballs etc...Lightweight and compact, allowing you to stowaway in the boot of your car or under the seatOn/off switchPlease note: This product is designed to be used as an emergency tyre inflator, you may top up tyres regularly or fill up one tyre which is completely flat, you should not use this product to fill up more than one tyre that's completely flat as it will overheat and shut down automatically.",BQ
62,Stanley Air Compressor D200/10/24V (UK) - 8117190STN722,150.00,Air compressors,https://www.diy.com/departments/stanley-air-compressor-d200-10-24v-uk-8117190stn722/8016738797466_BQ.prd,https://media.diy.com/is/image/KingfisherDigital/goodyear-12v-portable-car-tyre-inflator-compressor-3m-cigarette-lighter-cord~5054242005076_01c_MP?wid=284&hei=284,Oil less compressor that is maintenance-free.Ideal for all hobby applications.Maximum Pressure 10 bar.Compact and easy to transport thanks to the handle built into the shroud.Control panel built into the cover.Features and benefitsOil less compressor that is maintenance-freeIdeal for all hobby applicationsMaximum Pressure 10 bar.Compact and easy to transport thanks to the handle built into the shroud.Control panel built into the coverHose and accessories not included,BQ
63,Einhell Power X-Change 18V Cordless Hybrid Portable Compressor PRESSITO,90.00,Air compressors,https://www.diy.com/departments/einhell-power-x-change-18v-cordless-hybrid-portable-compressor-pressito/4006825627244_BQ.prd,https://media.diy.com/is/image/KingfisherDigital/stanley-air-compressor-d200-10-24v-uk-8117190stn722~8016738797466_01c_MP?wid=284&hei=284,"The Einhell hybrid compressor Pressito is a multifunctional compressor with high-pressure and low-pressure pumps and the option of low-pressure suction. The practical hybrid compressor can be operated using either a power cable or a high-performance 18 Volt system battery from the Power X-Change series (6in1-function). The Pressito features a high-pressure pump for pumping air into car and cycle tires and is not only a perfect addition for the garage, it is also ideal for use out on the road as well - the compressor can inflate balls right where the action is or giving tires a final check before a big bike tour. The high-pressure pump has a maximum operating pressure of 11 bar and can be manually preset by the user. The auto shutoff function ensures that the compressor stops when the adjusted pressure is reached. The low-pressure pump enables air mattresses or inflatables to be inflated in next to no time, and the low-pressure suction function helps to make quick work of deflating. Changing between the high-pressure and low-pressure functions is selected by pushbutton. A 3-piece inflation set with adapters for car and cycle tires, for footballs and basketballs and for air matresses and rubber dinghies is also included. The cables and hoses for the hybrid compressor are kept directly on the tool itself, so that they can neither get in the way or get lost. There is also a set place on the housing for the inflation set. The hybrid compressor has a digital display with a pressure indicator, and the manual controls are user-friendly. The compact and light hybrid compressor can be stowed away easily and, thanks to the rechargeable battery and practical carry handle, can also be taken along in the car.Guarantee - 2 yearsComes with Compressor, 3 Piece Inflator KitFeatures and benefitsMember of the Power X-Change familyHybrid function: for use with a power cable/rechargeable batteryHigh-pressure pump for inflating car tires, cycle tires, ballsLow-pressure pump for inflating air mattressesLow-pressure suction facility for deflating air mattressesEasy-to-operate manual digital pressure indicatorHigh-pressure pump with adjustable pressure settings up to 11 barWith auto shutoff function when adjusted pressure is reached",BQ
63,Einhell PXC Pressito Hybrid Compressor Body Only,96.13,Air compressors,https://www.toolstation.com/einhell-pxc-pressito-hybrid-compressor/p44180,https://cdn.aws.toolstation.com/images/141020-UK/250/72517.jpg,"• Power input: 90W• Max. operating pressure: 11 bar• Hose length: 710mm • Body only, no battery, charger or case supplied.• Compressor oil sold separately, code  94582 High-pressure pump for inflating car tires, cycle tyres, balls. Low-pressure pump for inflating air mattresses. Low-pressure suction facility for deflating air mattresses. Easy-to-operate manual digital pressure indicator.  Auto shutoff function when adjusted pressure is reached.As a member of the one battery fits all Power X-Change system the batteries and charger can be used across the whole Einhell Power X-Change range of power tools and garden machines.Compatible Batteries & Chargers:Einhell 18V Power X-Change Battery 1.5Ah Code 85540Einhell 18V Battery 2.0Ah Code  33979 Einhell 18V Power X-Change Battery 3.0Ah Code 88986Einhell 18V Battery 4.0Ah Code  44689 Einhell 18V Battery 4.0-6.0Ah Code  64253 Einhell PXC 18V Battery 3.0Ah Plus Slimline Code  11928 Einhell Power X-Change High Performance PXC Plus Battery 1 x 2.6Ah Code 92025Einhell Power X-Change High Performance PXC Plus Battery 1 x 5.2Ah Code  51595 Compatible Battery Starter Kits:Einhell PXC 18V Battery Twin Pack 2 x 4.0Ah Code  31288 Einhell Power X-Change 18V Battery & Charger 3.0Ah Code  13525 Einhell PXC 18V Battery & Charger 1 x 4.0Ah Code  51882 Einhell PXC 18V Battery & Charger 1 x 5.2Ah Code  20585",Toolstation
64,Einhell 24 Litre 8 Bar Oil Free Air Compressor TC-AC 200/24/8 OF,140.00,Air compressors,https://www.diy.com/departments/einhell-24-litre-8-bar-oil-free-air-compressor-tc-ac-200-24-8-of/4006825640496_BQ.prd,https://media.diy.com/is/image/KingfisherDigital/einhell-power-x-change-18v-cordless-hybrid-portable-compressor-pressito~4006825627244_01c_MP?wid=284&hei=284,"The Einhell TC-AC 200/24/8 OF compressor is a multifunctional item of basic equipment that no garage or workshed should be without.Guarantee - 2 yearsFeatures and benefitsThe Einhell TC-AC 200/24/8 OF compressor is powered by an oil-free and service-free motor with low maintenance requirements. The 24 litre tank has sufficient air reserves. The operating pressure of maximum 8 bar can be regulated by a pressure reducer. For controlled working pressure there is a pressure gauge and a quick-release coupling. For safety for all applications there is a non-return and safety valve, and there is also a drain plug for user-friendly maintenance. A secure standing position is ensured by the vibration-damped foot, and for easy transportation there are large wheels and a holding bar. Einhell is convinced of the quality and offers a 10-year rust-through warranty for the tank.Oil-free, service-free motor for little maintenanceThe 24 litre tank offers plenty of air reservesApplications up to 8 bar can be set using the pressure reducerPressure gauge & quick-release coupling for controlled pressureLarge wheels and holding bar for easy transportVibration-damped foot for standing securely10 years warranty against rusting through of the tankNon-return valve, safety valve",BQ
65,Zipper COM24E 24L Air Compressor 230 V,179.99,Air compressors,https://www.diy.com/departments/zipper-com24e-24l-air-compressor-230-v/9120039232638_BQ.prd,https://media.diy.com/is/image/KingfisherDigital/einhell-24-litre-8-bar-oil-free-air-compressor-tc-ac-200-24-8-of~4006825640496_01c_MP?wid=284&hei=284,"Guarantee - 1 yearFeatures and benefitsDesigned for the home user for light and light occasional use, the Zipper COM24E is an affordable air compressor that combines performance and safety in the one unit. It features a powerful 1100 W motor, 24 litre air receiver, 8 bar maximum operating pressure, and has a 165 L/min air flow intake with sufficient power to operate a variety of tools.1-cylinder air compressor with start discharge and motor protection24 Litres tank capacityOil lubricated compressor2 clear manometers for tank and working pressureDrain valve at tank bottomChassis with stable push barQuick connect coupling for a variety of pneumatic toolspower output: 165 l/min",BQ
65,Zipper ZI-COM24E 24Ltr Brushless Electric Air Compressor 230V,179.99,Air compressors,https://www.screwfix.com/p/zipper-zi-com24e-24ltr-brushless-electric-air-compressor-230v/233rt,https://media.screwfix.com/is/image/ae235/233RT_P?$autoprodblock$=&wid=136&hei=136&dpr=on,"Designed for the home user for light and occasional use. Features a powerful 1100W motor. Ideal for occasional paint spraying, tyre inflation, blow cleaning, stapling and maintenance jobs in the garage, garden and around the home.1.5hp Induction Motor130Ltr/min Free Air DeliveryMax. Pressure: 8barOil-Lubricated1 Air CouplingTank & Working Pressure ManometersBrushless Motor",Screwfix
66,Scheppach HC51Si 550W 50 LTR Silent Air Compressor - Oil Free,299.99,Air compressors,https://www.diy.com/departments/scheppach-hc51si-550w-50-ltr-silent-air-compressor-oil-free/4046664123422_BQ.prd,https://media.diy.com/is/image/KingfisherDigital/zipper-com24e-24l-air-compressor-230-v~9120039232638_01c_MP?wid=284&hei=284,"Guarantee - 1 yearComes with Supplied with HC51Si compressor : 1 x carry handle, wheel set (pair), rubber feet x 1, fixing bolts, 2 x air filters, instructionsFeatures and benefitsDesigned for quieter working environments, the HC51Si air compressor is whisper quiet and with a 60 dB(A) noise level is no louder than a regular conversation between two people, making this Scheppach compressor a perfect fit for applications where little noise is required. It features a powerful 1500 W motor and oil-free compressor pump which requires no maintenance and will give years of trouble free running. The ideal machine for all those tasks around the home where an ultra quiet compressor is needed.Powerful 1500 W motor50 Litre capacity air tank8 bar / 112 psi max. operating pressure300 L/min air intake capacityNoise pressure level (LPA) approx. 60 dB(A) at 7 m.2 x Built-in remote pressure regulator2 x quick release couplerLong life oil-free air pump - Maintenance free",BQ
