product,price,category,link,image,description
Armitage Shanks Monaco 2 Doc M Assisted Living Pack White,£614.98,N/A,https://www.toolstation.com/armitage-shanks-monaco-2-doc-m-assisted-living-pack/p99434,https://cdn.toolstation.com/assets/toolstation-logo-halo.svg,"Complete with: • Armitage Shanks Sandringham 21 Raised Height WC pan and cistern with lever handle• Armitage Shanks Bakasan toilet seat (no cover)• Armitage Shanks handrinse basin with bottle trap and 1 1/4"" waste • 1 x hinged arm support rail• Armitage Shanks Sandringham 21 Basin Mixer Tap• 1 x 45cm Grab Rail • 4 x 60cm Grab Rail• BS8300 compliant• Left or right hand single tap hole basin"
Croydex Double Door MDF Bathroom Cabinet 450 x 600 x 140mm,£63.98,N/A,https://www.toolstation.com/croydex-double-door-mdf-bathroom-cabinet/p43881,https://cdn.toolstation.com/assets/toolstation-logo-halo.svg,• Simple self assembly format• One adjustable shelf• Easy to install• Magnetic push catch opening• All fittings included• Mirrored• Dimensions are HWD
Rhinovent Ultra Breathable Membrane Classic 1 x 50m,£74.99,N/A,https://www.toolstation.com/rhinovent-ultra-breathable-membrane/p83455,https://cdn.toolstation.com/assets/toolstation-logo-halo.svg,"The Rhinovent Ultra Breathable membrane is a medium weight, breathable underlay for roof tiles. It can also be used to line walls made from OSB boards or timber on small outdoor buildings such as sheds and summer houses.The membrane is flexible and easy to use thanks to its non-woven spun-bond polypropylene layers. The Rhinovent underlay can be used for both warm non-ventilated and cold ventilated systems. It also provides good weatherproofing for those unexpected breaks, whether it be rain, wind or snow. It also protects from small debris and dust. The membrane can handle all the loads associated with roofing, while also ensuring long-lasting durability.• 1x 50 m roll• Underlay width of 1000 mm• BBA-certified medium weight breathable roof tile underlay• Suitable for warm and cold roof applications• Requires no ventilation if installed in accordance with instructions"
Automatic Hand Dryer Brushed Chrome 2500W,£137.98,N/A,https://www.toolstation.com/automatic-hand-dryer/p61305,https://cdn.toolstation.com/assets/toolstation-logo-halo.svg,"• 360° rotating nozzle• Air velocity: 30 m/s• Automatic operation• 10-15 seconds drying time• Vandal proof• CE, RoHS approved• IP21• Dimensions: 270x240x200mm• Weight: 6kg• Sound Level: 80-85 dB• BS EN60335-2:2003• 220-240V"
Draper Booster Cables 3.5m x 29mm² 6V/12V,£24.99,N/A,https://www.toolstation.com/draper-booster-cables-35m-x-29mm2/p42266,https://cdn.toolstation.com/assets/toolstation-logo-halo.svg,"Suitable for petrol engines up to 5.5L and diesel engines up to 3L. Cables insulated with PVC for added durability. Heavy duty handles. Supplied in zip bag.For 6V/12V systems and petrol engines commonly found in motorbikes, cars and light commercial vehicles. Includes 2 year warranty."
YBS General Purpose ThermaWrap Insulation 600mm x 7.5m,£19.99,N/A,https://www.toolstation.com/ybs-general-purpose-thermawrap-insulation/p16779,https://cdn.toolstation.com/assets/toolstation-logo-halo.svg,"Keep rooms warmer in the winter and cooler in the summer by installing YBS ThermaWrap. This general purpose insulation can be used for almost any DIY application – use it anywhere from roofs, walls and floors to motorhomes, boats and cellars.ThermaWrap reflects radiant heat back into the living space – this helps to retain warmth, cutting down on unnecessary energy use and saving you money. Its core bubble profile traps air within the small bubble pockets to offer great thermal benefits, while the outer aluminium foil layers increase the overall performance, due to their high reflectiveness. • General purpose insulation for use in almost any DIY application• Suitable for roofs, walls, floors and many more installations• Retains heat in your home, helping to save energy and money• Built-in airtight vapour control layer reduces risk of condensation• Up to 66% reduction in heat loss (based on a single layer in a pitched roof)• Thin, flexible and lightweight – easy to install• R-Value up to 1.47m²K/W (equivalent to 65mm of Mineral Wool)• Zero fibres removes the need for PPE• CE-marked to industry standards• Made in Britain"
"Minotaur Adjustable Wide Jaw Wrench 10"" OJC 50mm",£13.98,N/A,https://www.toolstation.com/minotaur-adjustable-wide-jaw-wrench/p71469,https://cdn.toolstation.com/assets/toolstation-logo-halo.svg,"This Minotaur adjustable wide jaw wrench is a really practical bit of kit that deserves a place in every toolbox. Its jaws are made from chromium-vanadium steel (Cr-V), so they’re hard and strong. You'll find that they won’t rust and won’t deform under pressure. The jaws open extra-wide and the measurements are laser etched, meaning they won't fade with use either. The soft-grip handle is ergonomically designed to sit comfortably in the hand. This wrench's jaws can be set to a full 50 mm wide, and it's 10"" (approximately 25 cm) in length.• Adjustable jaw can be opened up to 50mm• Slimline angled jaw ideal for use in confined spaces• Easy-to-read laser etched markings• Hardened Cr-V construction for long-lasting performance• Ergonomic soft-grip handle is comfortable to hold"
Hook Up Unit 2 x 16A Socket & RCBO,£99.12,N/A,https://www.toolstation.com/hook-up-unit/p26149,https://cdn.toolstation.com/assets/toolstation-logo-halo.svg,"• IP44 Hook Up Point • 2 gang unmetered  • Made to the latest UK regulations• Pre wired with Tri rated cables • Double Pole RCBOs 30mA• Compliant MID approved meters (where fitted, enabling you to charge for electricity usage)• Pre fitted with 35mm loop in and out terminals as standard • Galvanised mounting stake (88559) also available"
Water Storage Tank LWH: 508 x 860 x 515mm 25 Gallon,£61.78,N/A,https://www.toolstation.com/water-storage-tank/p12098,https://cdn.toolstation.com/assets/toolstation-logo-halo.svg,WRAS approved. Made to BS4213 : 2004.Lid available separately  47335 .
Duck Cloth Duct Tape White 50mm x 25m,£5.99,N/A,https://www.toolstation.com/duck-cloth-duct-tape/p89629,https://cdn.toolstation.com/assets/toolstation-logo-halo.svg,"• Sticks firmly to most surfaces• Waterproof • Tears easily • Interior and exterior useIdeal for hundreds of uses around the home, garage and garden. High strength adhesive sticks firmly to most surfaces. Waterproof and temperature resistant."
Radio Aerials 3 Element,£18.99,N/A,https://www.toolstation.com/radio-aerials/p84718,https://cdn.toolstation.com/assets/toolstation-logo-halo.svg,"Radio aerial suitable for DAB reception. Suitable for outdoor or loft installation. Includes heavy Duty mast clamp. Use in conjunction with 12491, 69098 or 29194 for easy install.• Outdoor aerial optimised for DAB radio reception• Band VHF-DAB 174-230MHz• 3 Element• Easy Termination with Saddle & Clamp"
C.K MightyRod Standard Cable Rod Set 10m,£31.98,N/A,https://www.toolstation.com/ck-mightyrod-standard-cable-rod-set/p91186,https://cdn.toolstation.com/assets/toolstation-logo-halo.svg,"With the perfect balance of rigidity and flexibility, this CK MightyRod set will have you covered for the majority of your cable routing requirements.The high sheen fibreglass composite rods are designed to minimise snagging and splintering, while the triple-bonded steel connectors ensure extreme torsion and tensile strength. These connectors are slimline too, for easier accessibility through smaller holes.Each of these CK cable rods has a 5mm diameter, and is 1m long. There are 10 rods in the pack, along with a cable hook, mini eye and ring, coiled steel 190mm flexi-lead and 5mm adaptor.• Triple-bonded steel connectors for extreme torsion and tensile strength• High sheen fibreglass composite rods minimise snagging and splintering• 5mm rods offer an optimal balance of rigidity and flexibility• Slimline connectors further reduce snagging• Perfect for the majority of your cable routing requirements• Comes with 10x 1m rods, cable hook, mini eye and ring, coiled steel 190mm flexi-lead, 5mm adaptor (enables use with other brands)"
"Roughneck Demolition & Lifting Bar 37"" (970mm)",£29.98,N/A,https://www.toolstation.com/roughneck-demolition-lifting-bar/p63005,https://cdn.toolstation.com/assets/toolstation-logo-halo.svg,"The Roughneck demolition and lifting bar lets you dismantle nailed-down material and hoist heavy objects with ease. Use the bar to lift up floorboards, break up pallets and take down doors or windows frames. It also lets you lift up heavy objects, such as paving slabs, without having to get your hands under them.The 37” handle allows you to stand as you're breaking things apart or lifting something from the floor, which will help protect your back. By simply holding the tool and bending through the knees, you gain enough leverage to move objects from the ground without feeling any strain. The long handle is also helpful in overhead work, giving you the extra reach to pry high up materials. Its two pronged design works like a forklift, sliding under tricky surfaces and keeping them balanced on top of the bars as they rise. The rounded heel of the fork lets you roll it under a surface to increase momentum, making it easier to move heavy objects.• Ideal for ripping up floorboards• Indispensable for demolition work• Lift heavy objects like paving slabs without risking injury to fingers• 37"" (970 mm)• Double crowbar design• Contractor grade• Drop forged steel construction• Heat treated for extra durability• Heavy duty"
White LED IP20 Dual Voltage Shaver Light 8W 480lm,£31.48,N/A,https://www.toolstation.com/white-led-ip20-dual-voltage-shaver-light/p91776,https://cdn.toolstation.com/assets/toolstation-logo-halo.svg,• IP20• 240V and 110V shaver outputs
Einhell 1.6hp 24L Oil Free Compressor + 5Pc Airtool Kit 230V,£129.98,N/A,https://www.toolstation.com/einhell-16hp-24l-oil-free-compressor-5pc-airtool-kit/p57053,https://cdn.toolstation.com/assets/toolstation-logo-halo.svg,"Enjoy simple operation and hassle-free upkeep when you use this Einhell TC-AC 200/24/8 air compressor. It’s powered by an oil-free and service-free motor, which means minimal maintenance requirements.The 24L tank has sufficient air reserves, and the maximum operating pressure of 8 bar can be regulated by a pressure reducer. For controlled working pressure, there is a pressure gauge and a quick-release coupling. For safety there is a non-return and safety valve, and there is also a drain plug for user-friendly maintenance.A secure standing position is ensured by the vibration damped foot and, for easy transportation, there are large wheels and a holding bar. Einhell is convinced of the quality and offers a 10-year rust through warranty for the tank. Supplied with a five-piece air tool kit.• Large 24L tank offers plenty of air reserves• Maximum operating pressure of 8 bar• Powerful 15,000 rpm motor delivers suction power of 180L per minute• Oil-free and service-free motor for little maintenance• Many applications up to 8 bar can be set by pressure regulator• Pressure gauge and quick-release coupling for controlled pressure• Non-return and safety valve for added safety• Wheel-mounted with pull handle ensures it’s easy to move• Supplied with five-piece air tool kit• 10-year manufacturer’s warranty against rusting through of tank (T&Cs apply)"
FireAngel Pro Connected Wireless Interlink CO Alarm Battery Powered,£56.69,N/A,https://www.toolstation.com/fireangel-pro-connected-wireless-interlink-co-alarm/p21393,https://cdn.toolstation.com/assets/toolstation-logo-halo.svg,"Advanced electrochemical carbon monoxide sensor with a loud, clear, alarm. Large test button and end of life alert. Wall mountable or portable for the home. Powered by 10 year sealed for life battery."
Sentinel X400 Sludge Remover 1L,£19.18,N/A,https://www.toolstation.com/sentinel-x400-sludge-remover/p28178,https://cdn.toolstation.com/assets/toolstation-logo-halo.svg,"High performance cleaner, specifically designed for cleaning older central heating systems. A non-acid treatment which restores circulation to radiators and pipework. Ruthlessly efficient formula shifts built-up magnetite sludge, eliminating cold spots in radiators and restoring proper heat distribution."
Ebb + Flo Braye Taps Basin Pillar,£31.48,N/A,https://www.toolstation.com/ebb-flo-braye-taps/p11605,https://cdn.toolstation.com/assets/toolstation-logo-halo.svg,"• Brass tap body with zinc handles• 5 years manufacturer's warranty (T&Cs apply)• Complete with brass plated zinc back nuts and rubber washers• Basin mixer complete with stainless steel flexible hoses 11605: 1/2"" ceramic disc valve operation. 5.5Ltr/min at 0.1 bar52104: 3/4"" ceramic disc valve operation. 10Ltr/min at 0.1 bar94015: 40mm ceramic disc cartridge. 6Ltr/min at 0.2 bar92468: 3/4"" ceramic disc valve operation. 14Ltr/min at 0.1 bar20561: 3/4"" ceramic disc valve operation. 19Ltr/min at 0.2 barThese basin pillar taps from Ebb+Flo feature a polished chrome finish to complement the sturdy brass construction. With ½” ceramic disc valve operation via the twin lever tap handles, water flows seamlessly for simple, safe operation by all members of any household. Featuring easily identifiable hot and cold water selection, these bathroom taps are suitable for all water systems and pressures for smooth, quiet function, and are WRAS approved.• Twin lever tap handles• Chrome finish• ½” ceramic disc valve• Suitable for 2 tap hole basin• Suitable for high and low pressure• Min. working pressure: 0.1 bar• Max. working pressure: 5.0 bar• WRAS approved"
Minotaur Wood Chisel Set,£10.98,N/A,https://www.toolstation.com/minotaur-wood-chisel-set/p85696,https://cdn.toolstation.com/assets/toolstation-logo-halo.svg,"Blades are hardened and tempered to exacting standards, ensuring that the cutting edge remains sharper for longer. Metal striking cap prolongs life and prevents handles from mushrooming. Set includes; 13, 19, 25mm and storage wallet.High quality chisels for professional work. Manufactured from chrome vanadium steel. Strike force passes through the chisel into the workpiece for greater efficiency and control.• Chrome vanadium sharpened blades• Soft grip handle• Storage wallet Includes:• 13mm• 19mm• 25mm"
Ebb + Flo Contract Lever Pillar Kitchen Taps,£27.48,N/A,https://www.toolstation.com/ebb-flo-contract-lever-pillar-kitchen-taps/p31110,https://cdn.toolstation.com/assets/toolstation-logo-halo.svg,"• Brass tap body with zinc handle• Suitable for high and low pressure• 1/2"" ceramic disc valve operation• Min working pressure: 0.1 bar• Complete with brass plated zinc back nuts and rubber washers• WRAS approved• 5 year manufacturer's warranty (T&Cs apply)These kitchen pillar taps from Ebb+Flo feature a polished chrome finish to complement the sturdy brass construction. With ½” ceramic disc valve operation via the modern, twin lever tap handles, water flows seamlessly from the short arm pillar spouts. Featuring easily identifiable hot and cold water selection, these kitchen taps are suitable for all water systems and pressures for smooth, quiet function and high flow rates, and are WRAS approved."
DeWalt DW088CG-XJ Cross-Line Green Laser Level,£149.49,N/A,https://www.toolstation.com/dewalt-dw088cg-xj-cross-line-green-laser-level/p67672,https://cdn.toolstation.com/assets/toolstation-logo-halo.svg,"If you’re working on your own, this DeWalt cross line laser is the perfect companion to help you make sure your work is level and true. It’s so simple to use, with two-button operation to select between horizontal or vertical lines – or both at the same time.This versatile laser level can be used wherever you need it. It’s designed with a strong magnetic pivoting base for a firm attachment to metal surfaces, and also comes with a bracket for attachment to walls or ceilings. The smooth pivoting function lets you transfer your marks to work around a room, and the green beam is far brighter than red alternatives. The laser is self-levelling up to 4°, and it’s protected by an overmolded housing along with thick glass – as well as improving the tool’s strength and durability, this helps to maintain calibration under jobsite conditions too.• Projects horizontal, vertical and cross lines• Green beam is four times brighter than red beam for greater visibility• Self levelling up to 4° surface angle, with automatic out-of-level indication• Accuracy of +/-3mm at 10m• Visibility range of 20m – increased to 50m if used with compatible detector  40258 • IP54-rated overmolded housing and thick glass for tough protection• Simple touch pad control with two-button operation• Low battery indication alerts you when replacements are needed• Strong magnetic pivoting base for flush attachment to metal surfaces• 1/4"" thread for use with tripod• Backplate bracket included for easy attachment to walls or ceilings• Pivoting feature helps you easily transfer your marks around a room• Includes bracket, 3x AA batteries for 16+ hours runtime and carry case"
Croydex ABS Grab Rail 450mm,£10.48,N/A,https://www.toolstation.com/croydex-abs-grab-rail/p51977,https://cdn.toolstation.com/assets/toolstation-logo-halo.svg,• Ribbed rail to aid grip• 100kg max load when fitted to a solid wall• 82mm diameter• Concealed fixings• Fixings not included
Crabtree Loadstar 10W Consumer Unit + 8 MCBs 63A Type A RCDs,£89.99,N/A,https://www.toolstation.com/crabtree-loadstar-10w-consumer-unit-8-mcbs/p39128,https://cdn.toolstation.com/assets/toolstation-logo-halo.svg,"• 10 Way Flexible configuration as High Integrity or Dual RCD• 100A double pole isolator• 63A 30mA Type A double pole RCDs• Populated with 8 Type B Miniature Circuit Breakers (4 x 6A, 1 x 16A, 1 x 20A, 2 x 32A) + 2 Blanks• Constructed from a full metal enclosure with curved visor• Surface mounted• IP2XC• BS EN 61439-3"
Polypropylene Flexible Conduit 20mm x 100m Coil Black,£69.99,N/A,https://www.toolstation.com/polypropylene-flexible-conduit/p20536,https://cdn.toolstation.com/assets/toolstation-logo-halo.svg,"You can safely encase electrical wires and protect them from damage with this black polypropylene flexible conduit coil from Pro-Fix. The reliable coil comes in a 100 m length, making it a popular choice for larger commercial jobs. This 20 mm tubing is flexible to ensure you can easily mould it into place around large and awkwardly-shaped objects.Made from hard-wearing polypropylene, it's tough enough to withstand the knocks and scrapes of daily life. This material is easy to cut to size, which reduces both waste and installation costs. For safety, it's self-extinguishing and will stop burning once the source of a flame is removed.• Protects cables, conductors and wiring• Corrugated tubing is more flexible and ideal for use around sharp bends• Comes in a 100 m length but is easily cut to size• Temperature range of -5°C to 90°C• Self-extinguishing for added safety"
Stanley Control Grip Long Nose Pliers 200mm,£10.38,N/A,https://www.toolstation.com/stanley-control-grip-long-nose-pliers/p52186,https://cdn.toolstation.com/assets/toolstation-logo-halo.svg,"Induction hardened blade and tempered jaws for long life, sharpness and gripping strength. Ergonomically designed handles allow for varying degrees of pressure and control.Stanley Control Grip Long Nose Pliers are made from forged carbon steel. They feature precision milled cutting edges and pivot for a smooth opening and closing of the jaws. All exposed steel surfaces have been sanded and are protected against corrosion. The bi-material, ergonomically designed handles allow for varying degrees of pressure and control.• Forged carbon steel jaws and handle for long life• Induction hardened edge for durability• Bi-material handle for comfort• Varying handle grip for control*Colour and finish may vary"
Spacepro Classic 4 Door Sliding Wardrobe Kit Cashmere and Mirror 2370 x 2260mm,£480.00,N/A,https://www.toolstation.com/spacepro-classic-4-door-sliding-wardrobe-kit-cashmere-and-mirror/p48748,https://cdn.toolstation.com/assets/toolstation-logo-halo.svg,"Don’t let any storage space go to waste. With these sliding wardrobe doors, you’ll make full use of every available inch – Spacepro Classic offers unparalleled style and practicality.As well as maximising wardrobe space, you’ll open up the room too – choosing Spacepro sliding doors instead of hinged alternatives could save you up to 500mm of floor space in front of the wardrobe.The attractive mirror and cashmere panel sliding doors come with a track that can be easily cut to size. For a complete installation, combine the doors with Spacepro framing kits, end panels and interior storage – all sold separately.• Four 610mm sliding doors maximise storage space• Ideal aperture of 2260(H) x 2370(W)mm• Stylish cashmere panel and mirror finish doors• Colour-matched trackset included• Easy to install in a matter of hours• Traditional frame design with a curved profile for easy handling• Framing kits, end panels and interior storage sold separately• 10-year manufacturer’s guarantee on all moving parts (T&Cs apply)"
Keter Folding Work Bench,£57.68,N/A,https://www.toolstation.com/keter-folding-work-bench/p10910,https://cdn.toolstation.com/assets/toolstation-logo-halo.svg,"Need a strong and reliable workbench, wherever you go? The impressive Keter folding workbench is perfect for busy workers who are always on the move – it's lightweight enough to easily carry from job to job, yet it's sturdy and robust enough to work with loads of up to 453kg when assembled.No time is wasted when you need to set up. Simply pull the release latches and lift the table top. The legs will automatically drop into place, and you just need to lock the side supports and fasten the table. Assembly takes just 30 seconds – it really is that easy!The two clamps can be positioned horizontally or vertically, which means they're easily adjustable to suit almost any job. The bench itself is secure and stable too, thanks to built-in leg stabilisers and integrated universal metal T-track rails. With the Keter folding work table, you'll be in complete control no matter what the job is.• Folded to fully assembled in just 30 seconds, so no time is wasted• Strong and sturdy design with a safe working load of 453kg / 1,000lb• Two adjustable clamps can go horizontally or vertically to suit almost any job• Lockable side supports and leg stabilisers keep bench secure and stable• Easily folds flat in seconds to save valuable storage space between uses• Convenient handle makes it easier than ever to carry from job to job"
Stanley FatMax Groove Joint Waterpump Pliers 250mm,£18.38,N/A,https://www.toolstation.com/stanley-fatmax-groove-joint-waterpump-pliers/p78298,https://cdn.toolstation.com/assets/toolstation-logo-halo.svg,Drop forged construction for added strength. Easy to use due to PushLock™ adjustment button. Ergonomic bi-material handle. Induction hardened jaws for increased durability. 17 adjustable locking positions for versatility. Black chrome finish.
Bahco Trim Pad Remover Pliers,£31.79,N/A,https://www.toolstation.com/bahco-trim-pad-remover-pliers/p94974,https://cdn.toolstation.com/assets/toolstation-logo-halo.svg,"High performance alloy steel with black phosphate finish on the heads. Designed to facilitate the removal of trim pads, panels, staples, and door panels.• For the removal of trim pads, panels, staples etc• Suitable in areas with difficult access• Material: alloy steel• Finish: black phosphate• Length: 230mm"
Irwin Quick-Grip Mini 2 Pack 12''/300mm,£10.98,N/A,https://www.toolstation.com/irwin-quick-grip-mini-2-pack/p21564,https://cdn.toolstation.com/assets/toolstation-logo-halo.svg,"Looking for a set of compact clamps to achieve efficient bonding in tight spaces? These Irwin Quick Grip mini clamps deliver up to 150 lbs (63 kg) of clamping force despite their pocket sized proportions, so you'll get plenty of bang for your buck. Use them for lighter duty tasks where you need to glue materials together, as well as for holding and positioning work while you saw or drill.You can adjust the jaws of the clamp in various ways to suit the job, and use this tool with one hand. Thanks to the smooth, non-marring pads, the materials you're working with won't get damaged by the clamping action, and you can easily remove the pads for cleaning or to get a tighter grip. The devices are made from tough, reinforced resin, so they're real workhorses. The patented pistol grip design means they're comfortable to use.• Pack of two mini bar clamps• Up to 63kg of clamping force• Multi position jaws• Quick release trigger• Removable, soft, non-marring pads• Carbon steel I-beam bar for continuous pressure• Comfortable pistol grip• Ideal for lighter duty applications"
