product,price,category,link,image,description
Stormguard EPDM Weatherstrip P Profile White 15m,£8.68,N/A,https://www.toolstation.com/stormguard-epdm-weatherstrip-p-profile/p32358,https://cdn.toolstation.com/assets/toolstation-logo-halo.svg,"This weatherstrip from Stormguard is ideal for sealing around doors and windows to keep out draughts and conserve heat, energy and money. It also forms an effective barrier against rain and dust. The weatherstrip is made from ethylene propylene diene monomer (EPDM) rubber, which offers excellent resistance to weathering, including ozone and UV. It's stretch resistant, both while you're fitting it and during its service life. Its p-shaped profile means you can achieve a snug seal against window and door edges of all shapes.The strip is self-adhesive so you can easily stick it into place. It's supplied in a length of 15m, but you can cut it to whatever length you need. This weatherstrip is suitable for sealing gaps measuring between 3mm and 5mm, and it's supplied with instructions to help you fit it using white spirit, a cloth and a pair of scissors.• P shaped profile helps form an effective seal against surfaces of all shapes• EPDM rubber is highly resistant to weathering• Excellent quality, long life, self-adhesive closed cell EPDM rubber draught strip• Seals gaps 3-5mm• Stretch resistant during fitting and in use"
Franke Titan Reversible Composite Kitchen Sink & Drainer 1.5 Bowl Graphite,£154.98,N/A,https://www.toolstation.com/franke-titan-reversible-composite-kitchen-sink-drainer/p83528,https://cdn.toolstation.com/assets/toolstation-logo-halo.svg,"This Franke composite kitchen sink and drainer will make an extremely stylish addition to your kitchen. Its graphite colour finish gives it an ultra-modern and sleek look, and it’s made from a solid granite composite material that consists of 95% natural stone and 5% resin. This material makes the Franke composite sink easy to clean and maintain, as the graphite colour is thermochemically bonded to the quartz particles, ensuring that the sink will still look new and scratch or stain-free year after year. The reversible design of the sink makes it easy to install, with indicators located underneath (on both the front and the back), to show where a tap hole can be installed. As a testament to its durability, it also comes with a 50-year manufacturer’s warranty.• Dimensions of 970(W) x 500(D) x 200(H) mm• 950 x 480 mm cut-out required, and a 600 mm minimum cabinet• Main bowl size of 340(L) x 420(W) x 200(D) mm• Half bowl size of 150(L) x 290(W) x 100(D) mm• Scratch, stain and UV-resistant to stay looking as good as new• Temperature-resistant to 280 °C• Comes with two 90 mm basket strainers to gather waste• Reversible design gives you the configuration you prefer• Indicators on underside of sink show where tap holes can be installed• Tap holes easily created from underside of sink using a 35 mm drill bit• 50-year manufacturer's warranty (T&Cs apply)"
Philips LED Tube T8 600mm 8W G13 CW,£8.38,N/A,https://www.toolstation.com/philips-led-tube-t8/p77368,https://cdn.toolstation.com/assets/toolstation-logo-halo.svg,• Average life 15000 hours• Non-dimmable• CRI 80• 4000K• 8W 800lm• 16W 1600lm  34562 • 20W 2000lm  10690
Draper Expert Heavy Duty Steel 4 Shelving Extension Unit 1040 x 610 x 1830mm,£199.99,N/A,https://www.toolstation.com/draper-expert-heavy-duty-steel-4-shelving-extension-unit/p34710,https://cdn.toolstation.com/assets/toolstation-logo-halo.svg,"Expert Quality, four shelf extension unit of robust construction manufactured from high quality steel ideal for industrial or domestic use. Wire construction shelves avoid collection of dust. Modular in design, it conjoins Draper Shelving Unit with 86509 using a common upright. Each shelf can carry up to 364kg (evenly distributed) giving a total of 1456kg. Easily assembled, instructions supplied."
Forest Garden Parisienne Arbour 212cm (h) x 154cm (w) x 66cm (d),£329.98,N/A,https://www.toolstation.com/forest-garden-parisienne-arbour/p99535,https://cdn.toolstation.com/assets/toolstation-logo-halo.svg,"Manufactured from smooth-planed, Pressure Treated timber for a superior build. Bench seat with a sloped back. Seats up to 2 people. Lattice side and back panels are great for training climbing plants and creating a little more privacy around the arbour. 15 Year Anti-Rot Guarantee. Manufactured from FSC certified timber from sustainable sources.Additional Delivery Information:• Whilst we aim to deliver within 5 days there may be some instances where it may take longer, for example hard to reach locations including some parts of Scotland.• Home Delivery is unable to be offered for the following postcodes, BT, GY, HS, IM, IV41-51, IV55-56, JE, KA27-28, KW15+, PA41+, PH41-44, PO31-41, ZE."
Prep Euro Filling Knife Set,£3.25,N/A,https://www.toolstation.com/prep-euro-filling-knife-set/p98277,https://cdn.toolstation.com/assets/toolstation-logo-halo.svg,"Carry out small mixing and filling jobs with this Prep Euro filing knife set. Each tool is ideal for working on walls, ceilings and woodwork so you can achieve a lovely smooth surface before you start coating on a fresh new lick of paint.The four-piece set includes sharp knives of varying sizes, so you're ready for everything from large areas to difficult-to-reach spots. Every one features carbon steel blades which are extra flexible, making it easy to spread the filler and ensure a smooth finish.• Flexible carbon steel blades• Suitable for small mixing or filling jobs on walls, ceilings and woodwork• 4 piece set includes 5cm, 8cm, 10cm and 12cm knives"
Wednesbury Copper Pipe 22mm x 2m,£139.38,N/A,https://www.toolstation.com/wednesbury-copper-pipe/p60997,https://cdn.toolstation.com/assets/toolstation-logo-halo.svg,"These 22mm copper pipes from Wednesbury are suitable for use in every aspect of a plumbing, heating, gas or sanitation system. The copper is extremely strong, durable and resistant to damage, yet bends easily and can be assembled both on or offsite prior to work. If you’re looking for a fit-and-forget solution, this is it.With an extremely high melting point in excess of 1000°C, copper systems can handle intense heat with no long-term problems, side-effects or drops in performance – there are 10 copper pipes in this pack, each 2m long, and they’ll always keep their strength and shape.Copper is a natural, corrosion-resistant material and an antimicrobial. Wednesbury copper piping will protect against contamination of a domestic water supply, as fluids, germs, oxygen or UV rays cannot penetrate it. Copper also has a positive environmental factor, with the added benefit of recyclability – it can be re-melted or re-made into new tubes or copper parts.• 22mm diameter pipe supplied in 10x 2m lengths• Extremely strong, durable and resistant to damage• Conforms to BS EN1057 2006 R250• Kitemarked to confirm pipe conforms to appropriate British Standard"
TB Davies Industrial Platform Step Ladder 6 Tread SWH 2.9m,£151.99,N/A,https://www.toolstation.com/tb-davies-industrial-platform-step-ladder/p59534,https://cdn.toolstation.com/assets/toolstation-logo-halo.svg,"Updated version of the classic Class 1 step ladder for the new EN131 Professional ladder standard, these industrial steps are available in both platform and swing-back versions. They are wider than before, but still manufactured in the UK from heavy-duty channel section stiles with riveted treads. (Available in sizes 3 to 12 treads)• Reinforced 330 x 255 checker-plate platform• Comfortable 80mm treads• Heavy duty all aluminium construction• Hinged metal locking stays provide optimal stability• Box section back legs with heavy-duty bracing• Slip resistant feet provide a firm footing• 5-year warranty• Max load 150kg• EN131 Professional• Treads:6• Storage Height x Width x Depth:2.06 x 0.54 x 0.13m• Max Height:2.06m• Platform Height:1.29m• Weight:9.1kg• Material: Aluminium"
Double Roll Lining Paper 20m x 0.53m - 2000g,£6.45,N/A,https://www.toolstation.com/double-roll-lining-paper/p72961,https://cdn.toolstation.com/assets/toolstation-logo-halo.svg,"Expertly prepare your walls for decoration with this 2000 grade lining paper. The 20m roll gives you around 11.2m² of coverage – it’s a great value option that provides the perfect base for decorating with other wallcoverings or emulsion paint.Using this extra-thick lining paper helps you protect and prepare older or damaged plaster for decorating. It will help to smooth out severely damaged or crumbling surfaces, while disguising other damage such as cracked, holed and blistered plasterwork.• 20m roll of 560mm wide lining paper• Roll covers approximately 11.2m²• Smooths out walls in preparation for decorating• Can be painted or papered on top• Hides blemishes and imperfections• Allows surfaces to breathe• Contains no PVC or glass fibres• Made using paper from well managed sources• Works well with Solvite All Purpose Wallpaper Adhesive –  27571"
Stanley FatMax Pro-Stack Deep Box,£24.99,N/A,https://www.toolstation.com/stanley-fatmax-pro-stack-deep-box/p44387,https://cdn.toolstation.com/assets/toolstation-logo-halo.svg,"Versatile, customisable and built to last – the Stanley FatMax Pro-Stack is the perfect storage solution for keeping your tools and essentials well organised.This deep box is part of the Pro-Stack modular storage system, offering a 23L capacity for holding your hand and power tools. It also includes a removable tote tray for quick access to smaller hand tools and accessories. Use it on its own, or connect it with multiple units depending on what you need for the job.The heavy-duty metal latches and hinges have been built for added durability. This means your site essentials will be kept safe and tidy, so you’ll know exactly where everything is – no time wasted scrabbling around for stuff!• Part of the FatMax Pro-Stack modular storage system• Can be connected and customised with multiple units if needed• 23L capacity to easily store and transport hand or power tools• Removable tote tray for quick access to smaller tools and accessories• Bi-material handle on top of each unit for easy and comfortable lifting• Fitted with padlock eyes for more security• Strong handle allows you to lift up to 30kg"
Sensio LED Low Voltage Triangle Under Cabinet Light 24V Cool White 85lm,£29.68,N/A,https://www.toolstation.com/sensio-led-low-voltage-triangle-under-cabinet-light-24v/p39565,https://cdn.toolstation.com/assets/toolstation-logo-halo.svg,"These spotlights will help to make your kitchen a practical working space. Each light emits 85 lumens of light in a coned beam, and two or three of these installed every metre will illuminate your worktop so you can see exactly what you're doing while cooking up a storm.The lights are designed to be fitted underneath kitchen cabinets so you can make the most efficient use of your space. The stylish brushed stainless steel housing is suitable for surface or flush mounting, to give your interior a modern look.They come in a pack of three lights. Each is fitted with an energy-efficient non-replaceable LED lamp, a 24 V LED driver and 1.5 m connecting cables. Once the fittings are installed, the lamp can be simply pushed into place.• Stainless steel integrated 1.65W 24V LED fittings• Ideal for installation under kitchen cabinets• 3x 24V 1.65W 85lm lights• 1x 6W 24V LED driver and 1.5m connecting cables• Surface or recessed mounting• 5000K cool white light• This luminaire contains a built-in, non-replaceable LED lamp"
Hawksmoor 18V 33cm Cordless Lawnmower 1 x 4.0Ah,£159.98,N/A,https://www.toolstation.com/hawksmoor-18v-33cm-cordless-lawnmower/p68257,https://cdn.toolstation.com/assets/toolstation-logo-halo.svg,"• 5 cutting heights from 20mm-60mm• 33cm cutting width• 30L grass collection box with fill level indicator• Hand-propelled• Hardened steel cutting blade• Battery level indicator• Charging time: 100 minutes• Includes 1 x 18V 4.0Ah battery and single port chargerProduct details• 33cm cutting width• Adjustable 5 different cutting heights from 20mm-60mm• Brushed motor• No power cables required – simply charge and mow• 30L grass collection box with fill level indicator• Large, grass-protecting wheels for easy manoeuvrability• Soft grip push handle• Integrated carry handle• Impact-resistant Polypropylene plastic housing for durability• Includes one 18V 4.0Ah battery and single port charger• Battery level indicator with LEDs tells you when a recharge is needed• Batteries and charger can be used across the Hawksmoor cordless product rangeSpecification• Motor: Brushed • Voltage: 18V• Battery chemistry: Li-ion• Battery capacity: 4.0Ah• No. of Batteries: 1 piece• No. of Chargers: 1 piece• No load speed: 3500 rpm• Cutting width: 33cm• Cutting blade type: Hardened steel blade• Cutting heights: 20-60mm• Cordless or corded: Cordless • Mower propulsion type: Hand-Propelled• Grass collection:30L• Charging time: 100 minutes• Product net weight approx.: 7.7kg• Guaranteed sound power level: 93dB(A)Includes:  1x grass collection box, 1x 4.0Ah battery pack, 1 x charger,2x upper handlelocking nut and bolt , 2x screws, 2x cable clip"
"Lyte Domestic Extension Ladder 2 Section, Closed Length 2.2m",£106.99,N/A,https://www.toolstation.com/lyte-domestic-extension-ladder/p12373,https://cdn.toolstation.com/assets/toolstation-logo-halo.svg,"• Superior domestic extension ladder• Large 'D' shaped rungs• Non-slip feet riveted in place• Strong yet lightweight box section provides greater rigidity • BS2037 Class 3 Safety Rating• Extruded hooks and guides provide extra safety• Comprehensive range of sizes • Available in 2 and 3 section• Max 150kg load12373: 7 rungs, SWH 4.2m, Open Length 3.7m, 93562: 9 rungs, SWH 5.2m, Open Length 4.7m, 25475: 11 rungs, SWH 6.4m, Open Length 5.9m, 99961: 13 rungs, SWH 7.4m, Open Length 6.9m, 18274: 15 rungs, SWH 8.6m, Open Length 8.1m, 71687: 7 rungs, SWH 5.7m, Open Length 5.2m, 36738: 9 rungs, SWH 7.2m, Open Length 6.1m, 56613: 11 rungs, SWH 9m, Open Length 8.5mSWH is the recommended safe working height."
Hawksmoor Dirty Water Pump 1100W,£69.98,N/A,https://www.toolstation.com/hawksmoor-dirty-water-pump/p17862,https://cdn.toolstation.com/assets/toolstation-logo-halo.svg,"Need to remove large volumes of dirty water? This 1100W dirty water pump from Hawksmoor combines power and performance to do the job quickly and efficiently. An impressive flow rate means it’s capable of pumping out up to 308 litres per minute – that’s more than 18,000 litres in an hour.The pump is made from high-quality stainless steel, and the motor is protected by a high-grade mechanical seal which further reduces the need for maintenance. It can be fully submerged and lowered to a water depth of 7m – simply attach a rope to the sturdy handle on top, so you can submerge, lift or secure the unit easily and safely.Suitable for use in dirty water containing solids or particles of up to 20mm in diameter, the pump is perfect for clearing water from footings and ditches, as well as general duties. Using it with water containing abrasive substances such as sand should be avoided, and it’s not suitable for continuous use either – it’s recommended to rest the pump for 10 minutes after each hour of use, so it’s not suitable for fish ponds or fountains.For added peace of mind, thermal overload protection will turn off the pump if the motor starts to overheat. It also comes with a float switch, which can turn the pump on or off automatically with changes to the water level – this ensures you’ll use no more electricity than you need to.• AC 230V, 50Hz• Maximum pump rate: 308L/min• Maximum lifting height: 8m• Maximum submergence depth: 7m• Maximum grain size: 20mm• Hose connection: 25mm / 32mm / 40mm• Lowest pump start-up level: 135mm• Minimum water level: 33mm• Maximum water temperature: 35°C• Float switch turns pump off automatically with changes to water level• Sturdy handle helps you move the pump more easily• Thermal cut-out automatically switches pump off if motor overheats• Automatic air bleed valve releases any air pockets in the pump body• 10m cable length with BS plug• IPX8 rating"
Black & Decker 55W Mouse Detail Sander 240V,£19.98,N/A,https://www.toolstation.com/black-decker-55w-mouse-detail-sander/p72568,https://cdn.toolstation.com/assets/toolstation-logo-halo.svg,"• No load speed: 11000 rpm• Platen shape: mouse• Sanding action: orbital• Includes: 6 x sanding sheetsInspired by the computer mouse, the lightweight, compact and ergonomic design of the Black & Decker mouse sander enables you to sand the most intricate and uneven spaces with complete control and comfort. For ultimate sanding versatility, this sander is ideal for removal of paint and rust, cleaning glass, sanding in tight spaces and providing the finishing touches to your DIY projects, with ease.• Compact design gets you closer to the work surface for greater control• Detail base is designed to give better results when sanding intricate areas• Rotatable base allows user to rotate paper as it wears, extending paper life• Ideal for paint, varnish, cleaning glass, removing rust and sanding in tight spaces• Rubber grips for comfort and control• Rocker switch for continual operation, hands can move freely• Removable tips allowing other profile tips to be added for greater versatility• Tear drop shaped base to access tight corners• Quick fit sanding paper for faster sanding action and easier paper fitment"
Hawksmoor Carbon Steel Dutch Hoe 130mm,£14.43,N/A,https://www.toolstation.com/hawksmoor-carbon-steel-dutch-hoe/p82936,https://cdn.toolstation.com/assets/toolstation-logo-halo.svg,"Prepare the perfect vegetable patch with this handy hoe from Hawksmoor. You can use it to shape soil and dig furrows or shallow trenches when planting seeds and bulbs. It's also great for chopping out weeds or removing stones without having to get down on your hands and knees. This hoe is as useful to any smallholder as it is to a gardener preparing a patch of land by hand.  Tough and robust, the hoe is made from hardened steel so it stands up well to frequent wear and tear. A heavy-duty gauge head means you can chop through thick roots and break up clumps of hard clay soil to make sure your earth is in ideal planting condition. The soft-grip handle gives your hands comfortable cushioning and lets you keep a firm hold while working.• Made from hardened steel for long-lasting strength and performance• Heavy-duty gauge head takes on the tough jobs• Soft-grip handle keeps your hands comfortable throughout the job"
Mercia Overlap Apex Windowless Shed 6' x 4',£330.98,N/A,https://www.toolstation.com/mercia-overlap-apex-windowless-shed/p98118,https://cdn.toolstation.com/assets/toolstation-logo-halo.svg,"Looking to increase your outdoor storage without breaking the budget? This small garden shed from Mercia is the perfect solution – at just 4ft x 6ft, it won’t take up too much room but maximises the space it does use by incorporating an apex roof for extra height. This makes the shed ideal for storing taller items such as ladders, strimmers or hedge-trimmers.The overlap cladding offers great value for money – the horizontal boards overlap each other to encourage rain water to run off the building and keep your belongings safe from the weather. Thick wooden framing supports the panelling internally, ensuring a rigid and long-lasting structure. Up above, high-quality mineral roofing felt offers further protection from the elements.Solid sheet board is used to form the floor and roof. This cost-effective option is perfect for everyday general use and storage. Double doors make it easy to access and store larger items, while the shed’s windowless design keeps them secure and well out of sight.Self-assembly is simple, with all fixings and instructions included. You’ll also get a 10-year anti-rot guarantee – all you need to do is follow the recommended guidance regarding annual treatment of the wood. • Great value overlap cladding creates a strong, durable and weatherproof panel• Solid sheet roof and floor is a hard-wearing but cost-effective option• Mineral roofing felt provides a waterproof barrier to protect shed and its contents• Windowless design keeps your items well hidden for added security• Apex roofline creates extra height inside for storing taller equipment• Double doors make it easier to access or store your larger items• 10-year anti-rot guarantee for extra peace of mind (T&Cs apply)• Manufactured by hand in the UK using FSC-certified timber• Stress-free self-assembly with all fixings and instructions supplied"
Heavy Duty Landscape Fabric 1 x 14m,£11.98,N/A,https://www.toolstation.com/heavy-duty-landscape-fabric/p45800,https://cdn.toolstation.com/assets/toolstation-logo-halo.svg,"To reduce weed growth in your garden and pathways, choose this landscape fabric from Apollo. It's designed for use as a weed suppressant under gravel, stones, concrete slabs and chippings.The fabric is supplied as a 14m roll, which is more than enough for landscaping projects in small to medium-sized plots. It's made of heavy-duty woven polypropylene, making it extremely sturdy and long-lasting. It's also puncture resistant, so you can safely use it under stones and gravel.This fabric allows the penetration of water and nutrients, which will keep your soils nice and healthy. Plus, it helps retain moisture, which means you won't need to water your plants as often. The fabric is easy to cut and fit to the size and shape you require, making for quick installation. This material is suitable for professional landscapers and gardening enthusiasts alike.• Heavy-duty woven suppressant prevents unwelcome weeds appearing• Perfect for use under patio slabs, paving, decking and decorative stones• Puncture-resistant design keeps weeds suppressed• Allows water and nutrients to penetrate soil and keep it healthy• Supplied in a 1 x 14m roll"
Forest Garden Pressure Treated Contemporary Double Slatted Fence Panel 6' x 6',£693.98,N/A,https://www.toolstation.com/forest-garden-pressure-treated-contemporary-double-slatted-fence-panel/p14491,https://cdn.toolstation.com/assets/toolstation-logo-halo.svg,"Want extra privacy for your garden without losing its bright and breezy feel? These double-slatted fence panels from Forest tick all the boxes – their 1.83m height provides seclusion from neighbours or passers-by, but the slatted construction allows light and air to pass through easily. The slats are mounted alternately on the front and back of the panels, which also creates a contemporary look that adds a modern feel to any garden. The timber is pressure-treated to give a 15-year anti-rot guarantee, and is FSC-certified for peace of mind that it’s been sustainably sourced.• Double-slatted design for a stylish and contemporary garden panel • Allows light and air to pass through while retaining privacy• High-quality smooth planed and rounded timber slats• 1.83m (6ft) panel height provides complete privacy for your garden• Pressure-treated for a longer life and less maintenance• 15-year anti-rot guarantee for added peace of mind (T&Cs apply)• Manufactured from sustainably-sourced FSC-certified timberAdditional Delivery Information• Please ensure that your contact number is registered on your Toolstation account, in order to arrange delivery• Home delivery is unavailable for the following postcodes: BT, GY, HS, IM, IV41-51, IV55-56, JE, KA27-28, KW15+, PA41+, PH41-44, PO30-41, ZE"
Integral LED Multi-Fit Round Downlight 12W 1020lm,£12.98,N/A,https://www.toolstation.com/integral-led-multi-fit-round-downlight/p97917,https://cdn.toolstation.com/assets/toolstation-logo-halo.svg,A configurable cut-out size from 65 to 160mm with a surface mount option provides installationflexibility.• Adjustable cut-out• Surface mountable• Frosted TPb diffuser• 4000K Cool White• Non-dimmableAverage life  30000 hoursDimensions: Dia 180mm x Depth 16mm
Bora 3 Light LED Chrome Bathroom Spotlight IP44 GU10 3 x 4.5W 330lm,£52.59,N/A,https://www.toolstation.com/bora-3-light-led-chrome-bathroom-spotlight-ip44-gu10/p21519,https://cdn.toolstation.com/assets/toolstation-logo-halo.svg,• IP44 chrome effect with frosted glass lens. • 3 x 4.5W 330lm• Cool White 4000k • Average life 25000 hours• Lamps Included
4lite WiZ Connected 4.9W LED Smart WiFi Bluetooth IP65 Fire Rated Downlight White - Warm to Cool White 345lm,£15.98,N/A,https://www.toolstation.com/4lite-wiz-connected-49w-led-smart-wifi-bluetooth-ip65-fire-rated-downlight/p46848,https://cdn.toolstation.com/assets/toolstation-logo-halo.svg,"Create a relaxing atmosphere with a warm, cosy white colour. Dimmable via the WiZ app. Added functionality includes setting schedules, providing home security, night lights, whilst saving energy• Selectable warm white (2200k) to cool white (6500k) up to 345lm• Dimmable• WiFi no HUB required • Plug & play via the WiZ app• Compatible with Alexa, Google Assistant, Apple Siri, Samsung Smartthings, IFTTT• LED lifetime 25000 hours• This fitting includes a GU10 tuneable white replaceable lamp.Diameter 90mm. Depth 101mm"
