product,price,category,link,image,description
Ximax Oxford Duo Designer Radiator 1800 x 595mm 6041Btu Anthracite,£352.96,N/A,https://www.toolstation.com/ximax-oxford-duo-designer-radiator/p32727,https://cdn.toolstation.com/assets/toolstation-logo-halo.svg,"A radiator from the Ximax Oxford Duo collection does far more than just heat your home. It instantly becomes a focal point in the room – with its modern panel design, this tall designer radiator adds style and sophistication to the decor of any modern home.Suitable for use with hot water heating systems, the radiator’s performance is just as impressive as its appearance. A high heat output will keep your room at the perfect temperature, and the powder-coated finish helps to radiate heat more effectively. It’s easy to install too, and comes with wall fixings, plug and vent included.• Modern panel design will become a stylish feature of any room• Suitable for hot water central heating systems• Steel construction with high-quality pre-treatment for robust durability• Powder-coated finish radiates heat from the surface more effectively• Heat output calculated at Delta T50°C• Pressure-tested to 5.2 bar, with a maximum working pressure of 4 bar• Maximum working temperature: 120°C• Projection from wall: 90mm• Wall to centre: 60mm• Connection size: 1/2""• Easy to install with wall fixings, plug and vent included• 10-year manufacturer's guarantee (T&Cs apply)• Manufactured and tested to EN-442"
Surge Protected Extension Lead 4 Gang 2m,£8.99,N/A,https://www.toolstation.com/surge-protected-extension-lead/p40915,https://cdn.toolstation.com/assets/toolstation-logo-halo.svg,"This four-gang extension lead is ideal for use with IT equipment in the home or office. The built-in power surge protection is a real advantage – a spike in electrical power can seriously harm electronics, so it’s good to know your valuable kit is protected. There’s a green light to show that surge protection is active. The plug is also changeable too. That’s a useful feature if you need to thread the cable through a small space. Simply remove the plug, pass the cable through and reattach it. • Robust four-gang extension lead for workshop, office or home use • Surge protection with green light indicator • 2 m cable helps you position your power points conveniently • 13 A"
Sentinel Eliminator Vortex250 Ultra-Compact Magnetic Filter Protection Pack 22mm Filter Only,£83.98,N/A,https://www.toolstation.com/sentinel-eliminator-vortex250-ultra-compact-magnetic-filter-protection-pack/p74624,https://cdn.toolstation.com/assets/toolstation-logo-halo.svg,"Ultra-compact filter for powerful magnetic filtration of all types of system debris associated with wet central heating systems. Fitted above or below a boiler, will protect the system against all typed of debris and is ideal where space is highly restricted.• Ideal for space constrained  and cupboard fit installs• Constructed from GRP with a brass forged T-piece• 22mm integrated isolation valve• Quick and easy cleaning without the need of stripping the filter• 9000 Gauss magnet with 180ml collection capacity• Easily serviced via the secure drain cap• Maximum temperature: 100°C• Maximum operating pressure: 3 bar• Maximum flow rate: 35 litres/min• Mounting: on horizontal or vertical pipework"
BG 13A Low Profile SP A & C Type USB Switched Socket 2 Gang 2 USB 4.1A,£17.49,N/A,https://www.toolstation.com/bg-13a-low-profile-sp-a-c-type-usb-switched-socket/p78846,https://cdn.toolstation.com/assets/toolstation-logo-halo.svg,
"Stanley Adjustable Quick Square 6¾"" (170mm)",£18.98,N/A,https://www.toolstation.com/stanley-adjustable-quick-square/p19400,https://cdn.toolstation.com/assets/toolstation-logo-halo.svg,"Heavy duty, aluminium construction with adjustable design. Can be used as a saw guide, bevel or protractor. Common, Jack and Hip and Valley scales for various applications. Black body with yellow graduations for maximum readability in various light conditions. Supplied with an adjustable arm."
"Old Hill Ironworks Fleur de Lys Tee Hinge 460mm 18""",£36.75,N/A,https://www.toolstation.com/old-hill-ironworks-fleur-de-lys-tee-hinge/p78479,https://cdn.toolstation.com/assets/toolstation-logo-halo.svg,"Pair of Fleur de Lys tee hinges of high quality iron construction. Protected with a high density zinc rich undercoat to increase durability, with a UV colour fast black powder coated finish. Salt spray tested for over 700 hours.• Dimensions: 460 x 120mm• 12 year manufacturer's mechanical guarantee (T&Cs apply)Complete with black stainless steel fixings."
Culina Single Gas Oven,£384.98,N/A,https://www.toolstation.com/culina-single-gas-oven/p54898,https://cdn.toolstation.com/assets/toolstation-logo-halo.svg,"• 2 function gas oven including gas grill• Natural gas only• 58 litre capacity• 1 Shelf and Grill Pan set• Energy Rating A• 5 years manufacturer's warranty on parts, 2 years manufacturer's warranty on labour (T&Cs apply)"
Triton 3 Spray Shower Handset Chrome,£18.88,N/A,https://www.toolstation.com/triton-3-spray-shower-handset/p77452,https://cdn.toolstation.com/assets/toolstation-logo-halo.svg,"• Universal fitting, fits most shower hoses• Easy clean• Suitable for all shower types• 1/2"" BSP shower head connection"
Baxi 600 Series Combi Boiler 24kW,£989.98,N/A,https://www.toolstation.com/baxi-600-series-combi-boiler/p30204,https://cdn.toolstation.com/assets/toolstation-logo-halo.svg,"• Compact size to fit in a 290mm deep cupboard• Top flue outlet• LCD display• Can be operated using a smart phone or tablet• Brass hydraulics• Seven year manufacturer’s guarantee (registration required, T&Cs apply)• This product should only be installed by a Gas Safe registered engineer.Unfortunately due to the nature of the products and for safety reasons, we cannot accept returns on unwanted boilers (your statutory rights are not affected). Please see the website for more details."
Stanza Toledo Door Handles Matt Black Latch,£12.98,N/A,https://www.toolstation.com/stanza-toledo-door-handles/p58560,https://cdn.toolstation.com/assets/toolstation-logo-halo.svg,"• Backplate length 170mm, width 40mm• Handle length 155mm, projection 66mm• BS EN 1634-1• Aluminium construction• Supplied with fixingsA modern choice for your home if you're looking to refresh the look of your door. This high-quality door handle is from the Zoo Stanza range of designer aluminium levers, with matching accessories available. With options in three finishes, they are sure to complement any door in your home, suiting both modern and traditional doors. With full aluminium construction and a slim easy to grip arched lever design, the Toledo Lever on Backplate provides long performance and fantastic aesthetic appeal. The Stanza Toledo on Backplate range is fire rated to 60 minutes and is also supplied with no plastic packaging."
110V Tool Transformer 3kVA 2 x 16A Outlets,£86.99,N/A,https://www.toolstation.com/110v-tool-transformer/p80013,https://cdn.toolstation.com/assets/toolstation-logo-halo.svg,For use with 110V power tools. Tough GRP case. Fitted 13A plug.
"Irwin Jack Saw Triple Pack 550mm (22"")",£29.99,N/A,https://www.toolstation.com/irwin-jack-saw-triple-pack/p81676,https://cdn.toolstation.com/assets/toolstation-logo-halo.svg,"Be ready for a range of sawing tasks with this triple pack of Irwin Jack hand saws. The set includes the 770 (coarse), 880 (universal) and 990 (fine) saws – a trade-quality trio that delivers best-in-class cutting performance.The triple-ground teeth on each saw have been designed to cut 25% faster, with blades made from high-quality C75 steel – this ensures maximum power transfer with every stroke. The large, soft-grip handles offer comfort as well as control, even if you’re wearing gloves.• Includes coarse, universal and fine hand saws• High-quality C75 steel for maximum power transfer• Triple-ground teeth cut through building materials faster• 90° and 45° markings• Soft-grip handles keep hands comfortable• Increased hand space for use with gloves"
Van Vault Tube 100 3030 x 90 x 126mm (Internal),£128.51,N/A,https://www.toolstation.com/van-vault-tube-100/p20133,https://cdn.toolstation.com/assets/toolstation-logo-halo.svg,"Designed for secure transportation of copper pipe and conduit. Carrying capacity of 34 lengths of 15mm tube and produced with a dual end loading system. Kit also includes 2 padlocks and 3 keys, plus universal roof fixing mounts."
C.K Triton XLS Insulated Screwdriver Set,£21.48,N/A,https://www.toolstation.com/ck-triton-xls-insulated-screwdriver-set/p61933,https://cdn.toolstation.com/assets/toolstation-logo-halo.svg,"Large soft grip tri-lobe handle injection moulded directly to blade giving ultimate bond for reliability and durability. Anti roll flats to prevent screwdriver rolling off sloping surfaces. Toughened alloy steel blade. Precision machined tips to reduce the risk of tip breakage. Set contains: SL2.5, SL4, SL5.5, PZ1 and PZ2.Conform to EN60900:2004 tested to 10,000V. Safe for live working up to 1000V."
tado° Smart TRV Thermostatic Radiator Valve,£209.99,N/A,https://www.toolstation.com/tado-smart-trv-thermostatic-radiator-valve/p90577,https://cdn.toolstation.com/assets/toolstation-logo-halo.svg,"• Add additional Smart Radiator Thermostats to your setup to control multiple radiators and rooms individually.• Upgrade to Multi-Room Control to maximise your comfort and energy savings. Manage all settings within the Tado° app• Works with all standard radiators with thermostatic radiator valves. • Tado° Starter Kit (V2, V3, V3+)  with the Internet Bridge forms the basis of your setup• Box contains: 4x Smart Radiator Thermostat , various adapters, 4x 2 AA batteriesExperience a new level of comfort and well-being, whilst reducing your heating costs with the Tado° Smart Radiator Thermostats.For Tado° comfort in every room, expand your setup with additional Smart ThermostatsTado° can save even more on your heating costs and make life more comfortable with Multi-Room Control. The basis of your setup is a Tado° Starter Kit (V2, V3, V3+) with the Internet Bridge to connect to the internet. Add additional Smart Thermostats & Smart Radiator Thermostats to get even more control of your home climate. Control multiple heating zones and rooms individually. That way you always have the right temperature at the right time in every room or zone. You can manage all zones in the Tado° app for a clear overview.The new universal radiator thermostat can be mounted both vertically and horizontally, depending on the type of radiator."
Bostik PU91 Polyurethane Construction Sealant 300ml Black,£6.99,N/A,https://www.toolstation.com/bostik-pu91-polyurethane-construction-sealant/p71061,https://cdn.toolstation.com/assets/toolstation-logo-halo.svg,"• Extremely elastic • High modulus • Bubble and primer free• Professional grade • Interior and exterior useBostik PU91 Polyurethane Construction Sealant is a professional grade polyurethane sealant developed for sealing construction joints subject to high movement.This Black PU sealant is high modulus, bubble and primer free, and suitable for both interior and exterior applications."
6 Pin Euro Thumbturn Cylinder 30-30mm Nickel,£10.98,N/A,https://www.toolstation.com/6-pin-euro-thumbturn-cylinder/p63085,https://cdn.toolstation.com/assets/toolstation-logo-halo.svg,"This 6 pin Euro profile thumbturn cylinder is an easy way to create a secure door lock. It's operated by a key from one side and by a simple turn on the other.The thumbturn cylinder is made by door security specialists, Securefast, so you know you're in safe hands. It's also available in a choice of finishes to match all your other ironmongery. This product comes with three steel keys. To make sure the lock's secure, each cylinder is supplied with unique keys.• 6 pin Euro profile thumbturn cylinder• Key operation outside, thumbturn on the inside• Standard security level• Supplied with 3 steel keys• All cylinders supplied with a different cut key• Polished nickel finish"
Stixall Adhesive & Sealant 290ml Clear,£6.49,N/A,https://www.toolstation.com/stixall-adhesive-sealant/p77137,https://cdn.toolstation.com/assets/toolstation-logo-halo.svg,"Bond and seal virtually everything to anything with Stixall Extreme Power adhesive and sealant. The high strength glue is a versatile nail replacement solution with hybrid PMS polymer technology, and it's specifically designed to stick together most common construction materials. From jointing cladding panels to mounting mirrors, you'll find that Stixall is a handy tool around the site and home.The sealant is completely weatherproof and is resistant to most chemicals, petrol and UV light, so you can apply it both indoors and outdoors and achieve a permanent, durable fix. You can even use it underwater for tasks like fixing up broken pool tiles. Its quick curing formula offers an incredible initial grab, so you don't need to support it until it sets. To keep the job looking neat and professional, simply paint over it once it dries using any water based paint.• High bond strength• Solvent-free• Works under water• Over paintable• Interior and exterior use• Less than 5% shrinkage• Bonds to metals, most plastics, glass, concrete, plaster, plasterboard, polyester, perspex, glass, wood, enamel, painted surfaces etc"
Mermaid White Gloss Laminate Shower Wall Panel Tongue & Groove 2420mm x 1185mm,£217.98,N/A,https://www.toolstation.com/mermaid-white-gloss-laminate-shower-wall-panel/p56228,https://cdn.toolstation.com/assets/toolstation-logo-halo.svg,Laminate shower panels designed to create a seamless watertight finish without the need for grouting. • High pressure laminate bonded to a plywood core with a balancing laminate bonded to the reverse• Can be easily cut to the required size
Marshalltown Ezyscreed with Level 8ft / 2400mm,£147.98,N/A,https://www.toolstation.com/marshalltown-ezyscreed-with-level/p26369,https://cdn.toolstation.com/assets/toolstation-logo-halo.svg,"Screed concrete to a smooth and even layer and prepare for paving with Marshalltown Ezyscreed. Its multi-purpose design includes a built-in level so you can check the quality of your work without switching tools. The blade is dual-edged so you can use it for cutting and floating as well. The sharp edge of the blade can be used to remove high spots while the rounded edge mimics a bull float to create a smooth surface.The blade's rugged aluminium construction ensures it's lightweight and durable, so it's a handy choice for your tool bucket. The handle can be attached and detached based on your comfort. You'll find that it's best to attach the handle to the bottom of the blade, as it significantly increases the life of the blade. Ridges on the handle make sure it's comfortable on the hand.• Screed size of 2400 X 50 X 40 mm / 94.5 X 2 X 1.625”• Lightweight and durable aluminium construction• Can be used as a screed, float or check rod• Dual-edge design – sharp edge for cutting, and round edge for floating• Built-in level helps you check work for accuracySizes available:• 4ft (1200mm)• 6ft (1800mm)• 8ft (2400mm)"
Carlisle Brass Oxford Knob 38mm Polished Chrome,£2.98,N/A,https://www.toolstation.com/carlisle-brass-oxford-knob-38mm/p24876,https://cdn.toolstation.com/assets/toolstation-logo-halo.svg,"• Knob diameter: 38mm, rose diameter: 25mm, depth: 26mm• Includes fixingsThese traditional style round cabinet knobs suitable for multiple environments, feature concealed fixings for a seamless finish. With a robust zinc alloy construction, they are quality, durable knobs that will easily handle repeated use and look elegant for years to come. Suitable for all decors, the Oxford knob features subtle, ringed detailing that is echoed on the rose making them perfect as a finishing touch in any kitchen, bedroom or bathroom, with the rounded design providing a comfortable grip. Complete with a 10 year manufacturer's mechanical guarantee.• Elegant contemporary and modern contour and border detail• Ideal for use in bathrooms, bedrooms, and kitchens• Perfect for cabinet doors and drawers• Rounded design for comfortable use• Subtle, ringed detailing• Concealed fixings (fixings supplied)• Robust zinc alloy construction• 10 year warranty"
Doncaster Cables SWA Armoured Cable 3 Core 2.5mm2 Coil,£46.99,N/A,https://www.toolstation.com/doncaster-cables-swa-armoured-cable-3-core/p45829,https://cdn.toolstation.com/assets/toolstation-logo-halo.svg,• Basec • XLPE insulated
Mira Atom EV Thermostatic Bar Mixer Shower,£129.98,N/A,https://www.toolstation.com/mira-atom-ev-thermostatic-bar-mixer-shower/p17211,https://cdn.toolstation.com/assets/toolstation-logo-halo.svg,"With a focus on style and driven by performance, the Mira Atom EV shower will bring out the best in your bathroom’s appearance as well as your showering experience.Its high-grade chrome construction provides the smart and contemporary look to elevate any bathroom design. When you turn it on, it has the performance to match – it features Mira’s Magni-flo™ technology that delivers up to three times more flow than other mixer showers, even at low pressures.The four-spray showerhead and 1.25m hose provides the ultimate revitalising shower, every time. Temperature and water flow is controlled separately, helping you achieve the shower to match your mood, while Mira CoolShield™ technology prevents heat from transferring to exposed surfaces – perfect for the whole family.With a fast-fit kit supplied, installing the Mira Atom shower is quick and easy. Between uses, rub-clean nozzles help you keep it in top condition, while long-life filters and a replaceable cartridge ensure minimal maintenance.• Premium 110mm shower head for a superior showering experience• Stainless steel 11mm shower hose• Maximum temperature stop and thermostatic control for added safety• Mira Magni-flo™ technology provides up to 3x more flow – even at low pressure• Mira CoolShield™ technology ensures the valve doesn’t get hot during showering• Separate flow and temperature controls offer extra precision• Easy rub-clean nozzles• Cover existing holes with adjustable slide bar• Compatible with any water system and pressure• Minimal maintenance with long-life filters and replaceable cartridge• Includes fast-fit kit for quick, easy front-of-tile installation• Delivers 10.22 Ltr per minute at 0.5 bar• Minimum pressure of 0.1 bar• Maximum pressure of 10 bar• Four-spray handset with 1.25m hose• 150mm pipe centres• WRAS, KIWA and TMV2-approved• Five-year manufacturer's warranty (T&Cs apply)"
Kudox Premium Type 22 Steel Panel Radiator 600 x 1200mm 7208Btu,£82.12,N/A,https://www.toolstation.com/kudox-premium-type-22-steel-panel-radiator/p80524,https://cdn.toolstation.com/assets/toolstation-logo-halo.svg,"If you're looking for a radiator that's efficient and attractive, Kudox Premium's radiator is the right choice. The steel radiator is designed to work with any central heating system, typically seen in residential settings.This radiator comes with two panels and two convectors, so it acts fast and offers a high heat output. The steel unit features a nanoceramic surface coating that enhances resistance to corrosion and rust. A glossy white finish means it goes well with any home interior. Plus, it's fitted with a top grille and side panels so the inner pipework isn't visible.This radiator's horizontal and low-profile design means it's great for installing on walls with under-utilised space, such as beneath a window frame. It's supplied with all the necessary brackets and fixings to ensure quick and simple installation. Engineers have tested this radiator for quality and safety and it comes with a 15-year manufacturer's guarantee.• White central heating convector radiator• Pre-fitted top grille and side panels• High heat output performance• Brackets and fixings included for easy installation• Nanoceramic surface coating (RAL 9010)• Maximum working pressure of 1000 kPa / 10 bar• 15-year manufacturer's guarantee (T&Cs apply)"
Eurospec Ball Bearing Hinge Grade 7 Polished Stainless Steel,£5.98,N/A,https://www.toolstation.com/eurospec-ball-bearing-hinge-grade-7/p70669,https://cdn.toolstation.com/assets/toolstation-logo-halo.svg,"For smooth opening and closing action, try these ball bearing door hinges from Eurospec. These hinges are Grade 7 rated under BS EN 1935, meaning that they're suitable for use on 40kg doors (three hinges required).The stainless steel hinges have a smart finish to complement other door ironmongery. Use alongside an intumescent fire door seal on FD30 & FD60 fire doors.• Grade 7 stainless steel construction ball bearing hinge• Length: 76mm (3”)• Width: 51mm (2”)• Pack of two complete hinges• Suitable for use on doors up to 40kg - pair and half (3) hinges required• Supplied with screws for easy fixing to the door• CE marked and certified to BS EN 1935• Suitable for use on FD30 & FD60 fire doors (with intumescent)• Polished finish"
"Vivanco Dual Arm Tilt & Swing TV Wall Mount Bracket Small Up To 43""",£32.98,N/A,https://www.toolstation.com/vivanco-dual-arm-tilt-swing-tv-wall-mount-bracket/p32486,https://cdn.toolstation.com/assets/toolstation-logo-halo.svg,"Is the TV cabinet taking up too much space in your room? Try attaching your television to this full-motion TV wall bracket from Vivanco instead – it’s a robust steel bracket suitable for small to medium-sized televisions up to a maximum of 43”.Once mounted on the wall, this TV bracket is a real space-saver. You can position your television to within 58mm of the wall when you need extra room, or extend it as far out as 423mm. A 90º swing and a 15º tilt give you even more flexibility to find the perfect position.• Robust steel construction with black arm and black TV plate• Suitable for small and medium-sized TVs up to 43''• Maximum weight load of 25kg• Distance from wall can be adjusted from 58mm to 423mm• Flat profile with two arms and three hinges• Maximum swing radius of +/- 90° (for screen widths smaller than 846mm)• Horizontal level correction of +/- 6°• Stepless tilt adjustment of +5° / -15°• VESA mounting hole distances from 75 x 75mm to 200 x 200mm• Quick and easy installation• Includes fastening screws for the TV screen"
Kitchen Kit Ready Made Shaker Kitchen Cabinet Pull Out Base Blind Corner Unit Ultra Matt Cashmere 1000mm Right Hand,£398.68,N/A,https://www.toolstation.com/kitchen-kit-ready-made-shaker-kitchen-cabinet-pull-out-base-blind-corner-unit-ultra-matt-cashmere/p19087,https://cdn.toolstation.com/assets/toolstation-logo-halo.svg,"Ensure your two rows of kitchen cabinets are joined together perfectly with this blind corner base unit from Kitchen Kit. Like the rest of the rigid range, the unit is delivered pre-assembled so you’ll waste no time getting straight to the installation.The blind corner base cabinet includes a right-hand door with pull-out shelves to help you maximise storage space and make it easier to access items kept inside. The door has a soft-close mechanism too – no more doors slamming shut! Four adjustable legs ensure maximum stability, and a 49mm service void provides ample space for concealing pipes or wiring.The Kitchen Kit Shaker collection adds contemporary class to any layout. With their bevelled internal profile, Shaker doors feature a two-piece construction – a 15mm MDF base panel and 4mm framing, pressed together with a durable foil for long-lasting strength and style. Drawer fronts have an 18mm slab construction, creating a kitchen that looks every bit as good as it’s built.• Cabinet delivered ready-made – no time wasted assembling it yourself• Door is not fitted to the cabinet – hinges included for simple fitting• Fully integrated soft-close hinges – no more doors slamming shut• Pull-out shelves for tidy storage and easier access• Wirework included, but does not come fitted• 150mm adjustable legs to ensure maximum stability• 49mm rear service void for concealing pipes, wiring and other essentials• 18mm MFC cabinet with 8mm back for rigidity• Two-piece door construction with 15mm MDF base panel and 4mm framing• Door’s base panel and framing pressed together with durable foil• FIRA Gold certification on doors and cabinets• Rigid kitchen cabinets will be delivered on a pallet• Door handles, plinths, panels and other accessories sold separately• Tall kitchen units available separately for flatpack delivery• This ready made kitchen unit is non-returnable – please check dimensions and designs before ordering"
Door Closer Size 4 Silver,£47.98,N/A,https://www.toolstation.com/door-closer-size-4/p49506,https://cdn.toolstation.com/assets/toolstation-logo-halo.svg,"• Fixed power size 4• Suitable for inward & outward opening doors up to 1100mm wide and 80kg• Reversible, fits left or right• Suitable for timber, steel and uPVC doors• Closing and opening speed adjustment• Adjustable backcheck• Tested to EN1154, CE markedTypical applications: commercial, offices, schools, public buildings.• 1 hour fire tested on timber doors"
White Wardrobe Rail 1830mm,£17.98,N/A,https://www.toolstation.com/white-wardrobe-rail/p76609,https://cdn.toolstation.com/assets/toolstation-logo-halo.svg,• 19mm diameter rail• Can be cut to length• Powder coated finish
