id,name,price,category,link,image,description,source
82,Sika MaxMix Concentrated Mortar Plasticiser 1L,£12.71,Additives & chemicals,https://www.jewson.co.uk/p/sika-maxmix-concentrated-mortar-plasticiser-1-litre-CMSK1032,"https://media.jewson.co.uk/f_auto,q_auto/t_Regular/global/product-images/29916","The Sika MaxMix Concentrated Mortar Plasticiser is a dark brown coloured highly concentrated plasticising liquid admixture which is ideal for use in bricklaying mortars, renders, pointing and screeds. It treats up to 5 tons of cement and can be used for all situations where improved workability is needed and minimises cracking and provides long term resistance to freeze/thaw cycles. Sika plasticiser replaces lime in the mix and hence reduces the chance of efflorescence (salt formation) and smoothes out variations between separate batches of sand and cement. This improves the workability of mortar and helps prevent shrinkage, cracking, crazing and mild frost damage during the curing process.Features & benefitsSuperior plasticising action with fast drying timeFrost ResistanceMinimises cracking which provides long term resistanceProvides superior plasticising action",jewsonProducts.csv
82,Sika Maxmix Concentrated Plasticiser 1L,£12.64,Additives & chemicals,https://www.travisperkins.co.uk/cement-plasterciser-and-dyes/sika-maxmix-concentrated-plasticiser-1l/p/329932,https://dam-assets.apps.travisperkins.group/NmDB9/GPID_1000196969_IMG_00.jpg?width=300&height=300,"Sika MaxMix Plasticiser is a liquid air entraining agent for brick laying mortars, renders, pointing and screeds. It can be used in all situations where improved workability is required.Concentrate admixtureMeasured dosing systemEconomic in useProduces an excellent 'Fatty' mortarSpill proof bottleEquivalent to 25 Litres of conventional plasticiserFreeze thaw resistant when curedView more",tpProducts.csv
83,"Bostik Cement colours Black Liquid colour, 1L Plastic jerry can",£11.09,Additives & chemicals,https://www.diy.com/departments/bostik-cement-colours-black-liquid-colour-1l-plastic-jerry-can/5000403110356_BQ.prd,https://media.diy.com/is/image/Kingfisher/bostik-white-concrete-fibres-bag~5010591004085_01bq?wid=284&hei=284,"Guarantee - StatutoryCE markedKeep out of reach of children. See SDS for full details.Features and benefitsBostik Liquid Colours for Cement are a high quality pigment dispersion for colouring cement mixes such as mortar, render and screeds. The colours are lightfast and disperse easily and evenly into the mix. Bostik Liquid Colours for Cement use pigments that conform to EN 12878. Bostik Liquid Colours for Cement are suitable for colouring mortar and render and sand/cement screeds.Lightfast colourEasier incorporation into mixDoes not affect performance of mix",bqProducts.csv
83,Cementone Liquid Cement Colour 1ltr Black,£15.55,Additives & chemicals,https://www.bradfords.co.uk/everbuild-opti-mix-cement-colourant-black-1l-mcc001,https://www.bradfords.co.uk/media/catalog/product/cache/f7c81111a4a19ad296e9f8fd0fc16840/a/1/a1439d2136288b8330be797dbee0510c.jpg,"Bostik Cementone Liquid Colour for Cement are a high quality pigment dispersion for colouring cement mixes such as mortar, render and screeds. Suitable for colouring mortar, rendering – e.g. walls, swimming pools and colouring flooring – sand/cement screeds, and granolithic floors. Features & Benefits:   Colours are lightfast and disperse easily and evenly into the mix.  Easier incorporation into mix.  Does not affect performance of mix.  Gives an even depth of colour.  Uses pigments that conform to EN 12878: 2014",bradfordsProducts.csv
83,Bostik Cementone Rendabond PVA 1L,£8.94,Additives & chemicals,https://www.builderdepot.co.uk/cementone-rendabond-pva-1l,"https://www.builderdepot.co.uk/media/catalog/product/L/0/L008921_s_01_c5bf.jpg?quality=80&bg-color=255,255,255&fit=bounds&height=400&width=400&canvas=400:400","Bostik Cementone Rendabond PVA 1L is ready to use and is suitable for a wide range of building jobs. It is not only an excellent adhesive, but also a highly effective primer, admixture, bonding agent and dustproofer. Cementone Rendabond PVA is especially suitable where bond strength, permanence and grab are essential. It is economical, and suitable for interior use and dry service conditions. For damp or external situations Cementone SBR is recommended.Key featuresImproves adhesion and bond strengthProvides a non-mechanical keyReduces risk of lifting or crackingApplication Cementone Rendabond PVA bonds most building materials, provided one of the surfaces has a degrees of porosity e.g. timber, plywood, blockboard, chipboard, fibreboard, expanded polystyrene, polyurethane foam, insulating board, brick, concrete, stone, slate, felt, fabric etc. As a primer to improve adhesion to porous or difficult surfaces prior to rendering, plastering, screeding etc. It is an admixture to improve workability and adhesion of cement/sand mortars, renders, gypsum plasters, screeds etc. and as a sealer to reduce dusting of concrete and plaster surfaces.          Bostik Cementone Rendabond PVA Technical Data Sheet (PDF)",builderdepotProducts.csv
83,Kos Fire Cement 1kg,£7.00,Additives & chemicals,https://www.homebase.co.uk/kos-fire-cement-1kg/12803995.html,https://static.thcdn.com/images/xsmall/webp//productimg/original/12803995-1744846394627376.jpg,"This Kos Fire Cement 1kg cures when exposed to heat, resulting in a mortar which is resistant to temperatures up to 1250 degrees C.",homebaseProducts.csv
83,Bostik Cementone Liquid Colour for Cement 1L Black,£22.91,Additives & chemicals,https://www.jewson.co.uk/p/bostik-liquid-cement-1-litre-black-CMCEM106,"https://media.jewson.co.uk/f_auto,q_auto/t_Regular/global/product-images/1874","The Bostik Liquid Cement 1 Litre Black is a high-quality pigment dispersion for colouring cement mixes of concrete, mortar, render and screeds. The pigments conform to BS EN 12878:2005. It is a light-fast and can be dispersed easily into the dry mix. When used as recommended Cementone colours do not affect the final mix.Features & benefitsSuitable for concrete, mortar, renders (e.g. walls, swimming pools) & flooring (sand/cement screeds & granolithic floor)Does not affect the performance of a mixCan be easily dispersed in a dry mix",jewsonProducts.csv
83,Sika Maxmix Cement Colour Red 1L,£18.89,Additives & chemicals,https://www.travisperkins.co.uk/cement-plasterciser-and-dyes/sika-maxmix-cement-colour-red-1l/p/329939,https://dam-assets.apps.travisperkins.group/Ernxy/GPID_1000196976_IMG_00.jpeg?width=300&height=300,"Sika MaxMix Colour is a concentrated solution of pigments, suitable for brick laying, paving, renders, grouts and screeds. 1 litre treats up to 400kg of mortar.Concentrate admixtureFast colour dispersionEasy to use without the mess of powderSimple dosage system ensures accurate dosing in every mixLess weight and space required for transportation and less wasteView more",tpProducts.csv
84,"Gyproc Magnolia Drywall primer, 10L Tub",£83,Additives & chemicals,https://www.diy.com/departments/gyproc-magnolia-drywall-primer-10l-tub/189927_BQ.prd,https://media.diy.com/is/image/Kingfisher/bostik-cement-colours-red-liquid-colour-1l-plastic-jerry-can~5000403110363_01c_bq?wid=284&hei=284,Priming before applying plaster,bqProducts.csv
84,British Gypsum Gyproc Drywall Primer 10L,£74.28,Additives & chemicals,https://www.builderdepot.co.uk/british-gypsum-gyproc-drywall-primer-10l,"https://www.builderdepot.co.uk/media/catalog/product/H/0/H000082_s_01_3347.jpg?quality=80&bg-color=255,255,255&fit=bounds&height=400&width=400&canvas=400:400","British Gypsum Drywall Primer 10L is used in interior walls as an undercoat for new drywall. It can also be used on masonary surfaces and on patching compound before painting. British Gypsum Drywall Primer has excellent characteristics for sanding finishes.Key featuresUsed in new drywall and masonry surfacesAccepts most paintsQuick dryingEasy to sandEasy to applyApplicationPrior to the application of British Gypsum Drywall Primer the surface must be free from dust, grease, oil and other impurity. Stir the British Gypsum Drywall Primer thoroughly before use. Use a good quality brush or a roller and apply evenly along the surface. British Gypsum Drywall Primer should not be thinned if applying by roller or brush, however if using spraying equipment thinning maybe required.",builderdepotProducts.csv
85,"Knauf Insulation Eko Roll Loft insulation roll, (L)4.83m (W)1.14m (T)200mm",£25,Insulation & damp proofing,https://www.diy.com/departments/knauf-insulation-eko-roll-loft-insulation-roll-l-4-83m-w-1-14m-t-200mm/182147_BQ.prd,https://media.diy.com/is/image/Kingfisher/knauf-insulation-eko-roll-loft-insulation-roll-l-4-83m-w-1-14m-t-200mm~5012061862263_02c_bq?wid=284&hei=284,"This loft insulation is one of 3 pack sizes available from Eko Roll, this roll measures (L)4.83m (W)1400mm (T)200mm and provides excellent thermal performance.CE markedFeatures and benefitsEko Insulation is a new range of insulation available at B&Q. Specifically made for the thermal upgrade of loft spaces, at ceiling level, Eko Insulation has all your insulation needs coveredManufactured by one of the UK’s leading insulation manufacturer’s, Knauf Insulation, Eko Insulation is one of the most environmentally friendly and sustainable products around - it’s made using recycled glassOdourless, rot proof, non-hygroscopic, does not sustain vermin and will not encourage the growth of fungi, mould or bacteriaEasy to handle and install, being lightweight and easily cut to sizeSupplied in polythene packs which are designed for short term protection onlyFor longer term protection on site, the product should be stored either indoors, or under cover and off the ground. EkoRoll should not be left permanently exposed to the elements",bqProducts.csv
86,"Knauf Insulation Eko Roll Loft insulation roll, (L)4.83m (W)1.14m (T)200mm",£25,Insulation & damp proofing,https://www.diy.com/departments/knauf-insulation-eko-roll-loft-insulation-roll-l-4-83m-w-1-14m-t-200mm/182147_BQ.prd,https://media.diy.com/is/image/Kingfisher/knauf-insulation-eko-roll-loft-insulation-roll-l-4-83m-w-1-14m-t-200mm~5012061862263_02c_bq?wid=284&hei=284,"This loft insulation is one of 3 pack sizes available from Eko Roll, this roll measures (L)4.83m (W)1400mm (T)200mm and provides excellent thermal performance.CE markedFeatures and benefitsEko Insulation is a new range of insulation available at B&Q. Specifically made for the thermal upgrade of loft spaces, at ceiling level, Eko Insulation has all your insulation needs coveredManufactured by one of the UK’s leading insulation manufacturer’s, Knauf Insulation, Eko Insulation is one of the most environmentally friendly and sustainable products around - it’s made using recycled glassOdourless, rot proof, non-hygroscopic, does not sustain vermin and will not encourage the growth of fungi, mould or bacteriaEasy to handle and install, being lightweight and easily cut to sizeSupplied in polythene packs which are designed for short term protection onlyFor longer term protection on site, the product should be stored either indoors, or under cover and off the ground. EkoRoll should not be left permanently exposed to the elements",bqProducts.csv
87,"Knauf Insulation Eko Roll Loft insulation roll, (L)7.28m (W)1.14m (T)100mm",£22.50,Insulation & damp proofing,https://www.diy.com/departments/knauf-insulation-eko-roll-loft-insulation-roll-l-7-28m-w-1-14m-t-100mm/182146_BQ.prd,https://media.diy.com/is/image/Kingfisher/knauf-insulation-eko-roll-loft-insulation-roll-l-4-83m-w-1-14m-t-200mm~5012061862263_02c_bq?wid=284&hei=284,"This loft insulation is one of 3 pack sizes available from Eko Roll, this roll measures (L)7.28m (W)1.14m (T)100mm and provides excellent thermal performanceIs one of 3 pack sizes available from Eko Roll, this roll measures (L)7.28m (W)1400mm (T)100mm and provides excellent thermal performanceFeatures and benefitsEko Insulation is a new range of insulation available at B&Q. Specifically made for the thermal upgrade of loft spaces, at ceiling level, Eko Insulation has all your insulation needs coveredManufactured by one of the UK’s leading insulation manufacturer’s, Knauf Insulation, Eko Insulation is one of the most environmentally friendly and sustainable products around - it’s made using recycled glassOdourless, rot proof, non-hygroscopic, does not sustain vermin and will not encourage the growth of fungi, mould or bacteriaEasy to handle and install, being lightweight and easily cut to sizeSupplied in polythene packs which are designed for short term protection onlyFor longer term protection on site, the product should be stored either indoors, or under cover and off the ground. EkoRoll should not be left permanently exposed to the elements",bqProducts.csv
88,"Antinox Protective board, (H)2.4m (W)1.2m",£5.60,Insulation & damp proofing,https://www.diy.com/departments/antinox-protective-board-h-2-4m-w-1-2m/1328561_BQ.prd,https://media.diy.com/is/image/Kingfisher/gyproc-moisture-resistant-square-edge-plasterboard-l-1-2m-w-0-6m-t-12-5mm~5015892884169_02bq?wid=284&hei=284,"Tough & trusted in the trade, Antinox is highly versatile and has the durability to withstand any job. Quick and easy to set up, the trade sheet will provide the highest level of cover to your site.To be used to protect floors and other surfacesTrial on a small area to ensure suitability before full installationGuarantee - StatutoryFeatures and benefitsLightweight, waterproof, flexible & easy to cut, Antinox trade sheet is the protection material of choice.Impact ResistantWaterproofEasy To CutReusableLightweight - Easy to handle and cover large areas quickly",bqProducts.csv
89,Recticel Instafit Polyurethane Insulation board (L)1.2m (W)0.45m (T)50mm of 1,£9.65,Insulation & damp proofing,https://www.diy.com/departments/recticel-instafit-polyurethane-insulation-board-l-1-2m-w-0-45m-t-50mm-of-1/5411545020296_BQ.prd,https://media.diy.com/is/image/Kingfisher/jablite-polystyrene-insulation-board-l-2-4m-w-1-2m-t-25mm~5010824760139_36c_bq?wid=284&hei=284,"This Recticel Instafit insulation board is ideal for both new build and refurbishment projects.Zero ozone depletion potentialInstafit thermal PIR cavity insulation board with a low emissivity multilayer coated aluminium facingFeatures and benefitsLightweightEasy to cut and handleLow lambda 0,022Easy to installWill not degrade or deteriorate if exposed to moisture",bqProducts.csv
92,"Rockwool Acoustic Cavity slab (L)1.2m (W)0.6m (T)50mm, Pack of 12",£87,Insulation & damp proofing,https://www.diy.com/departments/rockwool-acoustic-cavity-slab-l-1-2m-w-0-6m-t-50mm-pack-of-12/1440516_BQ.prd,https://media.diy.com/is/image/Kingfisher/recticel-instafit-polyurethane-insulation-board-l-2-4m-w-1-2m-t-100mm~5411545016664_02bq?wid=284&hei=284,"This stone wool insulation is sound insulation for internal walls and floors.CE markedSound Insulation for internal walls and floorsFeatures and benefitsOutstanding acoustic properties, absorbs sound waves and dampens vibrationsBest in class fire resistance. Withstands temperatures of over 1,000CFeatures the patented ROCKWOOL FLEXI Edge, for quick and easy fittingHighly stable and durable - works for the life time of the buildingEnvironmentally friendly. Made from abundant, naturally occurring volcanic rock which is 97% recyclable",bqProducts.csv
93,"Diall Insulation roll, (L)6m (W)0.37m (T)100mm",£18.60,Insulation & damp proofing,https://www.diy.com/departments/diall-insulation-roll-l-6m-w-0-37m-t-100mm/3663602481812_BQ.prd,https://media.diy.com/is/image/Kingfisher/rockwool-acoustic-cavity-slab-l-1-2m-w-0-6m-t-50mm-pack-of-12~5013423282224_08c_bq?wid=284&hei=284,"Features and benefitsAn eco-friendly alternative to traditional glass wool insulation, this recycled plastic insulation from Diall is comfortable to work with and is completely itch free. It is extremely easy to lay and comes in handy sized rolls to fit many existing rafter spaces.Easy to tear allowing it to be inserted into a variety of cavity spacesEach roll is made from approx. 85 recycled plastic bottlesRequires no protective equipment to work withBreathable",bqProducts.csv
95,Capital Valley Plastics Ltd Black 250 Micron Damp proof membrane,£21-£58,Insulation & damp proofing,https://www.diy.com/departments/capital-valley-plastics-ltd-black-250-micron-damp-proof-membrane-l-15m-w-4m/5060405961004_BQ.prd,https://media.diy.com/is/image/Kingfisher/diall-loft-storage-stilt-pack-of-12~3663602538240_01bq?wid=284&hei=284,"BBA approvedUse underneath concrete floors and slabs to prevent rising dampWater resistantFeatures and benefitsThe product is a durable, easy to use and puncture resistant barrier designed to stop moisture ingress into buildings through the floorBBA certified and ISO9001 approvedMade from 100% recycled materials",bqProducts.csv
96,Homelux Heatwave Insulation board (L)1.2m (W)0.6m,£15,Insulation & damp proofing,https://www.diy.com/departments/homelux-heatwave-insulation-board-l-1-2m-w-0-6m/109093_BQ.prd,https://media.diy.com/is/image/Kingfisher/capital-valley-plastics-ltd-black-250-micron-damp-proof-membrane-l-15m-w-4m~5060405961004_02bq?wid=284&hei=284,"Guarantee - 10 yearsIdeal for use under tiled flooringFeatures and benefitsHomelux Heatwave insulation board can be used underneath floor tiles. Each board is sized 1200mm x 600mm x 12mm and covers a floor area of up to 0.72m².Acts as an efficient thermal barrier, making heating systems up to 50% more efficientReduces heat up time making the heating system more cost effectiveLightweight and easy to cutProvides a smooth surface to tile on",bqProducts.csv
98,"Diall Reflective Bubble insulation roll, (L)14m (W)1.2m (T)7mm",£68,Insulation & damp proofing,https://www.diy.com/departments/diall-reflective-bubble-insulation-roll-l-14m-w-1-2m-t-7mm/5060078164535_BQ.prd,https://media.diy.com/is/image/Kingfisher/jablite-insulation-board~5010824760115_10c_bq?wid=284&hei=284,"Guarantee - 10 yearsFeatures and benefitsThis multi-use insulation is ideal for replacing existing insulation or adding to new buildings that require insulation with a certified thermal performance. It can be used on roofs, walls, floors, in outbuildings and garages or in vans, mobile homes and caravans.Made from 2x layers of aluminium lacquered with anti-oxidation treatment and 2x layers of bubbled polyethyleneCan also be used as radiator reflecting foil or to insulate exposed pipeworkLightweight to enable easy transportation and installationCan be cut to the required size using basic toolsHypoallergenic & non-itchFixings sold separately",bqProducts.csv
99,"Capital Valley Plastics Ltd Black 500 Micron Damp proof course, (L)30m",£5.16-£23,Insulation & damp proofing,https://www.diy.com/departments/capital-valley-plastics-ltd-black-500-micron-damp-proof-course-l-30m-w-300mm/5060405960939_BQ.prd,https://media.diy.com/is/image/Kingfisher/diall-reflective-bubble-insulation-roll-l-14m-w-1-2m-t-7mm~5060078164535_01c_bq?wid=284&hei=284,Features and benefitsThis damp proof course is designed to prevent rising damp within brickwork and stop structural problems such as black mold or rot from occurring.Can be applied both horizontally and verticallyEasy to trim and installWaterproof,bqProducts.csv
100,"Rockwool Acoustic Cavity slab (L)1.2m (W)0.4m (T)100mm, Pack of 6",£58,Insulation & damp proofing,https://www.diy.com/departments/rockwool-acoustic-cavity-slab-l-1-2m-w-0-4m-t-100mm-pack-of-6/1440515_BQ.prd,https://media.diy.com/is/image/Kingfisher/capital-valley-plastics-ltd-black-500-micron-damp-proof-course-l-30m-w-300mm~5060405960939_02bq?wid=284&hei=284,"This stone wool insulation is sound insulation for internal walls and floors.CE markedSound Insulation for internal walls and floorsFeatures and benefitsOutstanding acoustic properties, absorbs sound waves and dampens vibrationsBest in class fire resistance and withstands temperatures of over 1,000CFeatures the patented ROCKWOOL FLEXI Edge, for quick and easy fittingHighly stable and durable - works for the life time of the buildingEnvironmentally friendly. Made from abundant, naturally occurring volcanic rock which is 97% recyclable",bqProducts.csv
101,Homemate Flexible Door Insulation Tape 5m,£9.99,Insulation & damp proofing,https://www.diy.com/departments/homemate-flexible-door-insulation-tape-5m/5020873144118_BQ.prd,https://media.diy.com/is/image/Kingfisher/rockwool-acoustic-cavity-slab-l-1-2m-w-0-4m-t-100mm-pack-of-6~5013423282354_08c_bq?wid=284&hei=284,"This flexible rubber draught strip is perfect for stopping draughts around old or ill-fitting doors and windows.Features and benefitsIncludes high-quality tape for fixing to either the frame or the door/window. Draught proofing your home doesn’t need to cost the earth but could help to save it!Insulates rooms - keeps warmth in & cold draughts outSaves money - energy bills reduced, low cost effective insulation productEasy to applyPack includes 5m insulation tape plus high-quality adhesive for attaching to frame or door/windowMade in the UKSize: (insulation strip): 5m x 3.5cmSize: (double-sided tape): 5m x 9mm",bqProducts.csv
102,"Jablite Premium Polystyrene Insulation board (L)1.2m (W)0.45m (T)25mm, Pack of 8",£40,Insulation & damp proofing,https://www.diy.com/departments/jablite-premium-polystyrene-insulation-board-l-1-2m-w-0-45m-t-25mm-pack-of-8/26830_BQ.prd,https://media.diy.com/is/image/KingfisherDigital/homemate-flexible-door-insulation-tape-5m~5020873144118_01c_MP?wid=284&hei=284,"ThisPremium insulation board;Use to insulate walls, floors and roofsZero ozone depletion potentialUse to insulate walls, floors and roofsFeatures and benefitsWater repellentInsulation can make your home more energy efficient - and feel warmerEasy to cut and fit",bqProducts.csv
103,Capital Valley Plastics Ltd Black 300 Micron Damp proof membrane,£19.36-£68,Insulation & damp proofing,https://www.diy.com/departments/capital-valley-plastics-ltd-black-300-micron-damp-proof-membrane-l-3m-w-4m/5060405960991_BQ.prd,https://media.diy.com/is/image/Kingfisher/jablite-premium-polystyrene-insulation-board-l-1-2m-w-0-45m-t-25mm-pack-of-8~5010824074199_01c_bq?wid=284&hei=284,"BBA approvedUse underneath concrete floors and slabs to prevent rising dampWater resistantFeatures and benefitsThe product is a durable, easy to use and puncture resistant barrier designed to stop moisture ingress into buildings through the floorBBA certified and ISO9001 approvedMade from 100% recycled materials",bqProducts.csv
104,"Diall Acoustic & thermal Insulation roll, (L)5m (W)0.5m (T)4mm",£32,Insulation & damp proofing,https://www.diy.com/departments/diall-acoustic-thermal-insulation-roll-l-5m-w-0-5m-t-4mm/1906875_BQ.prd,https://media.diy.com/is/image/Kingfisher/capital-valley-plastics-ltd-black-300-micron-damp-proof-membrane-l-3m-w-4m~5060405960991_02bq?wid=284&hei=284,This Cork roll;Is Long-lasting & high puncture resistant.Is Long-lasting & high puncture resistant.Guarantee - 15 yearsFeatures and benefitsIdeal use for wall & floor insulationMade from harmless sustainable cork with no toxic impactHas a natural cork finish that can be left exposed or covered if desiredAcoustic & thermal insulation,bqProducts.csv
106,"Rockwool Acoustic Cavity slab (L)1.2m (W)0.4m (T)100mm, Pack of 6",£58,Insulation & damp proofing,https://www.diy.com/departments/rockwool-acoustic-cavity-slab-l-1-2m-w-0-4m-t-100mm-pack-of-6/1440515_BQ.prd,https://media.diy.com/is/image/Kingfisher/capital-valley-plastics-ltd-black-500-micron-damp-proof-course-l-30m-w-300mm~5060405960939_02bq?wid=284&hei=284,"This stone wool insulation is sound insulation for internal walls and floors.CE markedSound Insulation for internal walls and floorsFeatures and benefitsOutstanding acoustic properties, absorbs sound waves and dampens vibrationsBest in class fire resistance and withstands temperatures of over 1,000CFeatures the patented ROCKWOOL FLEXI Edge, for quick and easy fittingHighly stable and durable - works for the life time of the buildingEnvironmentally friendly. Made from abundant, naturally occurring volcanic rock which is 97% recyclable",bqProducts.csv
